Disease,Symptoms
HIV/AIDS,"mouth ulcers, night sweats, confusion, swollen lymph nodes, weight loss"
HIV/AIDS,"swollen lymph nodes, weight loss, night sweats, mouth ulcers, confusion"
HIV/AIDS,"mouth ulcers, night sweats, weight loss, swollen lymph nodes, confusion"
HIV/AIDS,"weight loss, night sweats, confusion, swollen lymph nodes, mouth ulcers"
HIV/AIDS,"confusion, mouth ulcers, swollen lymph nodes, weight loss, night sweats"
HIV/AIDS,"confusion, swollen lymph nodes, night sweats, weight loss, mouth ulcers"
Hantavirus,"enlarged liver, chills, sweating, high fever, headache"
Hantavirus,"headache, high fever, sweating, enlarged liver, chills"
Hantavirus,"chills, headache, high fever, enlarged liver, sweating"
Hantavirus,"enlarged liver, sweating, headache, high fever, chills"
Hantavirus,"high fever, chills, sweating, headache, enlarged liver"
Hantavirus,"sweating, enlarged liver, chills, high fever, headache"
Hantavirus,"enlarged liver, high fever, sweating, chills, headache"
Hantavirus,"chills, high fever, headache, sweating, enlarged liver"
Hantavirus,"high fever, chills, headache, enlarged liver, sweating"
Hantavirus,"sweating, enlarged liver, headache, high fever, chills"
Heart attack,"breathlessness, sweating, vomiting, headache, chest pain"
Heart attack,"vomiting, sweating, chest pain, breathlessness, headache"
Heart attack,"headache, breathlessness, vomiting, chest pain, sweating"
Heart attack,"vomiting, sweating, breathlessness, chest pain, headache"
Heart attack,"sweating, chest pain, headache, breathlessness, vomiting"
Heart attack,"vomiting, breathlessness, headache, chest pain, sweating"
Heart attack,"breathlessness, chest pain, vomiting, sweating, headache"
Heart attack,"chest pain, vomiting, headache, breathlessness, sweating"
Heart attack,"headache, vomiting, chest pain, breathlessness, sweating"
Heart attack,"sweating, chest pain, headache, vomiting, breathlessness"
Hemochromatosis,"heart problems, depression, weakness, irregular heartbeat, frequent infections"
Hemochromatosis,"irregular heartbeat, frequent infections, depression, heart problems, weakness"
Hemochromatosis,"weakness, heart problems, frequent infections, depression, irregular heartbeat"
Hemochromatosis,"depression, irregular heartbeat, heart problems, weakness, frequent infections"
Hemochromatosis,"heart problems, frequent infections, irregular heartbeat, depression, weakness"
Hemochromatosis,"irregular heartbeat, weakness, heart problems, depression, frequent infections"
Hemochromatosis,"frequent infections, weakness, irregular heartbeat, depression, heart problems"
Hemochromatosis,"weakness, irregular heartbeat, depression, frequent infections, heart problems"
Hemochromatosis,"weakness, depression, frequent infections, heart problems, irregular heartbeat"
Hemochromatosis,"frequent infections, irregular heartbeat, weakness, heart problems, depression"
Hemophilia,"slow wound healing, cough, weakness, prolonged bleeding after cuts, frequent infections"
Hemophilia,"prolonged bleeding after cuts, weakness, slow wound healing, cough, frequent infections"
Hemophilia,"weakness, prolonged bleeding after cuts, cough, slow wound healing, frequent infections"
Hemophilia,"frequent infections, prolonged bleeding after cuts, slow wound healing, weakness, cough"
Hemophilia,"weakness, frequent infections, cough, slow wound healing, prolonged bleeding after cuts"
Hemophilia,"weakness, slow wound healing, cough, frequent infections, prolonged bleeding after cuts"
Hemophilia,"frequent infections, slow wound healing, prolonged bleeding after cuts, cough, weakness"
Hemophilia,"prolonged bleeding after cuts, slow wound healing, cough, weakness, frequent infections"
Hemophilia,"weakness, frequent infections, prolonged bleeding after cuts, cough, slow wound healing"
Hemophilia,"weakness, cough, prolonged bleeding after cuts, slow wound healing, frequent infections"
Hendra Virus,"respiratory distress, brain inflammation, fever, confusion, fatigue"
Hendra Virus,"fatigue, brain inflammation, fever, respiratory distress, confusion"
Hendra Virus,"confusion, brain inflammation, respiratory distress, fever, fatigue"
Hendra Virus,"fatigue, respiratory distress, fever, confusion, brain inflammation"
Hendra Virus,"fever, brain inflammation, respiratory distress, confusion, fatigue"
Hendra Virus,"fever, respiratory distress, confusion, fatigue, brain inflammation"
Hendra Virus,"brain inflammation, confusion, respiratory distress, fever, fatigue"
Hendra Virus,"respiratory distress, fatigue, brain inflammation, fever, confusion"
Hendra Virus,"respiratory distress, fever, fatigue, confusion, brain inflammation"
Hendra Virus,"brain inflammation, respiratory distress, fatigue, confusion, fever"
Hepatitis A,"jaundice, dark urine, loss of appetite, abdominal discomfort, vomiting"
Hepatitis A,"abdominal discomfort, loss of appetite, vomiting, dark urine, jaundice"
Hepatitis A,"abdominal discomfort, vomiting, jaundice, loss of appetite, dark urine"
Hepatitis A,"dark urine, loss of appetite, vomiting, jaundice, abdominal discomfort"
Hepatitis A,"dark urine, loss of appetite, jaundice, vomiting, abdominal discomfort"
Hepatitis A,"dark urine, vomiting, loss of appetite, jaundice, abdominal discomfort"
Hepatitis A,"jaundice, abdominal discomfort, loss of appetite, dark urine, vomiting"
Hepatitis A,"dark urine, vomiting, loss of appetite, abdominal discomfort, jaundice"
Hepatitis A,"dark urine, jaundice, vomiting, abdominal discomfort, loss of appetite"
Hepatitis A,"abdominal discomfort, dark urine, vomiting, jaundice, loss of appetite"
Hepatitis B,"dark urine, joint pain, yellowing skin, nausea, fatigue"
Hepatitis B,"nausea, fatigue, joint pain, yellowing skin, dark urine"
Hepatitis B,"fatigue, nausea, yellowing skin, dark urine, joint pain"
Hepatitis B,"yellowing skin, nausea, dark urine, fatigue, joint pain"
Hepatitis B,"nausea, yellowing skin, joint pain, fatigue, dark urine"
Hepatitis B,"fatigue, dark urine, joint pain, yellowing skin, nausea"
Hepatitis B,"nausea, joint pain, dark urine, fatigue, yellowing skin"
Hepatitis B,"fatigue, nausea, joint pain, yellowing skin, dark urine"
Hepatitis B,"nausea, joint pain, yellowing skin, fatigue, dark urine"
Hepatitis B,"joint pain, fatigue, yellowing skin, nausea, dark urine"
Hepatitis C,"jaundice, clay-colored stool, joint pain, easy bruising, loss of appetite"
Hepatitis C,"easy bruising, joint pain, jaundice, loss of appetite, clay-colored stool"
Hepatitis C,"clay-colored stool, jaundice, loss of appetite, easy bruising, joint pain"
Hepatitis C,"joint pain, loss of appetite, clay-colored stool, easy bruising, jaundice"
Hepatitis C,"easy bruising, jaundice, clay-colored stool, loss of appetite, joint pain"
Hepatitis C,"easy bruising, joint pain, clay-colored stool, loss of appetite, jaundice"
Hepatitis C,"clay-colored stool, joint pain, loss of appetite, easy bruising, jaundice"
Hepatitis C,"clay-colored stool, easy bruising, loss of appetite, jaundice, joint pain"
Hepatitis C,"clay-colored stool, joint pain, jaundice, easy bruising, loss of appetite"
Hepatitis C,"loss of appetite, clay-colored stool, joint pain, jaundice, easy bruising"
Hepatitis D,"fatigue, vomiting, dark urine, yellowish skin, joint pain"
Hepatitis D,"yellowish skin, fatigue, vomiting, joint pain, dark urine"
Hepatitis D,"yellowish skin, dark urine, vomiting, fatigue, joint pain"
Hepatitis D,"fatigue, joint pain, vomiting, yellowish skin, dark urine"
Hepatitis D,"vomiting, fatigue, joint pain, yellowish skin, dark urine"
Hepatitis D,"fatigue, dark urine, joint pain, vomiting, yellowish skin"
Hepatitis D,"dark urine, vomiting, joint pain, yellowish skin, fatigue"
Hepatitis D,"joint pain, dark urine, vomiting, yellowish skin, fatigue"
Hepatitis D,"vomiting, fatigue, joint pain, dark urine, yellowish skin"
Hepatitis D,"joint pain, fatigue, dark urine, vomiting, yellowish skin"
Hepatitis E,"facial pain, fever, night sweats, weight loss, fatigue"
Hepatitis E,"night sweats, facial pain, fever, fatigue, weight loss"
Hepatitis E,"fever, fatigue, night sweats, weight loss, facial pain"
Hepatitis E,"weight loss, night sweats, fatigue, fever, facial pain"
Hepatitis E,"fever, facial pain, night sweats, weight loss, fatigue"
Hepatitis E,"night sweats, weight loss, fatigue, facial pain, fever"
Hepatitis E,"night sweats, weight loss, fever, fatigue, facial pain"
Hepatitis E,"night sweats, fever, fatigue, weight loss, facial pain"
Hepatitis E,"facial pain, weight loss, fever, night sweats, fatigue"
Hepatitis E,"weight loss, fever, night sweats, fatigue, facial pain"
Herpes,"painful sores, tingling sensation, flu-like symptoms, swollen lymph nodes, fatigue"
Herpes,"tingling sensation, flu-like symptoms, fatigue, swollen lymph nodes, painful sores"
Herpes,"tingling sensation, fatigue, painful sores, swollen lymph nodes, flu-like symptoms"
Herpes,"tingling sensation, fatigue, flu-like symptoms, swollen lymph nodes, painful sores"
Herpes,"swollen lymph nodes, painful sores, tingling sensation, fatigue, flu-like symptoms"
Herpes,"flu-like symptoms, fatigue, painful sores, swollen lymph nodes, tingling sensation"
Herpes,"fatigue, painful sores, swollen lymph nodes, tingling sensation, flu-like symptoms"
Herpes,"swollen lymph nodes, flu-like symptoms, painful sores, tingling sensation, fatigue"
Herpes,"flu-like symptoms, painful sores, swollen lymph nodes, tingling sensation, fatigue"
Histoplasmosis,"chest pain, joint pain, cough, fever, headache"
Histoplasmosis,"cough, joint pain, chest pain, fever, headache"
Histoplasmosis,"joint pain, fever, cough, headache, chest pain"
Histoplasmosis,"headache, joint pain, chest pain, fever, cough"
Histoplasmosis,"chest pain, fever, headache, joint pain, cough"
Histoplasmosis,"cough, headache, chest pain, fever, joint pain"
Histoplasmosis,"fever, headache, chest pain, cough, joint pain"
Histoplasmosis,"fever, cough, chest pain, headache, joint pain"
Histoplasmosis,"joint pain, fever, cough, chest pain, headache"
Histoplasmosis,"joint pain, fever, headache, cough, chest pain"
Hodgkin's Lymphoma,"dry patches, anxiety, mucus production, wheezing, fatigue"
Hodgkin's Lymphoma,"mucus production, wheezing, anxiety, fatigue, dry patches"
Hodgkin's Lymphoma,"mucus production, wheezing, dry patches, anxiety, fatigue"
Hodgkin's Lymphoma,"mucus production, wheezing, dry patches, fatigue, anxiety"
Hodgkin's Lymphoma,"anxiety, wheezing, mucus production, fatigue, dry patches"
Hodgkin's Lymphoma,"wheezing, dry patches, mucus production, anxiety, fatigue"
Hodgkin's Lymphoma,"fatigue, dry patches, anxiety, mucus production, wheezing"
Hodgkin's Lymphoma,"fatigue, anxiety, wheezing, mucus production, dry patches"
Hodgkin's Lymphoma,"wheezing, anxiety, dry patches, mucus production, fatigue"
Hodgkin's Lymphoma,"dry patches, anxiety, wheezing, fatigue, mucus production"
Hookworm Infection,"itchy rash, cough, stomach pain, anemia, vomiting"
Hookworm Infection,"vomiting, itchy rash, cough, stomach pain, anemia"
Hookworm Infection,"vomiting, cough, stomach pain, anemia, itchy rash"
Hookworm Infection,"itchy rash, vomiting, cough, stomach pain, anemia"
Hookworm Infection,"stomach pain, vomiting, cough, anemia, itchy rash"
Hookworm Infection,"vomiting, itchy rash, stomach pain, anemia, cough"
Hookworm Infection,"stomach pain, cough, anemia, itchy rash, vomiting"
Hookworm Infection,"vomiting, anemia, cough, itchy rash, stomach pain"
Hookworm Infection,"anemia, cough, stomach pain, vomiting, itchy rash"
Hookworm Infection,"itchy rash, anemia, vomiting, stomach pain, cough"
Huntington's Disease,"depression, impulsive behavior, anxiety, involuntary movements, sleep disturbances"
Huntington's Disease,"involuntary movements, depression, impulsive behavior, sleep disturbances, anxiety"
Huntington's Disease,"anxiety, sleep disturbances, involuntary movements, impulsive behavior, depression"
Huntington's Disease,"sleep disturbances, impulsive behavior, anxiety, involuntary movements, depression"
Huntington's Disease,"sleep disturbances, involuntary movements, depression, impulsive behavior, anxiety"
Huntington's Disease,"sleep disturbances, depression, impulsive behavior, anxiety, involuntary movements"
Huntington's Disease,"impulsive behavior, sleep disturbances, depression, involuntary movements, anxiety"
Huntington's Disease,"depression, involuntary movements, impulsive behavior, anxiety, sleep disturbances"
Huntington's Disease,"sleep disturbances, anxiety, depression, involuntary movements, impulsive behavior"
Huntington's Disease,"impulsive behavior, anxiety, depression, sleep disturbances, involuntary movements"
Hyperglycemia,"increased thirst, frequent urination, blurred vision, fatigue, headache"
Hyperglycemia,"blurred vision, frequent urination, increased thirst, fatigue, headache"
Hyperglycemia,"increased thirst, fatigue, headache, frequent urination, blurred vision"
Hyperglycemia,"headache, fatigue, frequent urination, blurred vision, increased thirst"
Hyperglycemia,"blurred vision, fatigue, headache, frequent urination, increased thirst"
Hyperglycemia,"increased thirst, blurred vision, frequent urination, headache, fatigue"
Hyperglycemia,"frequent urination, fatigue, headache, increased thirst, blurred vision"
Hyperglycemia,"frequent urination, increased thirst, headache, fatigue, blurred vision"
Hyperglycemia,"increased thirst, headache, blurred vision, fatigue, frequent urination"
Hyperglycemia,"increased thirst, blurred vision, fatigue, frequent urination, headache"
Hypertension,"excessive salivation, chest pain, cough, shortness of breath, fatigue"
Hypertension,"fatigue, chest pain, cough, shortness of breath, excessive salivation"
Hypertension,"shortness of breath, excessive salivation, cough, chest pain, fatigue"
Hypertension,"excessive salivation, cough, fatigue, chest pain, shortness of breath"
Hypertension,"chest pain, excessive salivation, fatigue, shortness of breath, cough"
Hypertension,"fatigue, shortness of breath, cough, excessive salivation, chest pain"
Hypertension,"shortness of breath, fatigue, excessive salivation, chest pain, cough"
Hypertension,"excessive salivation, chest pain, fatigue, cough, shortness of breath"
Hypertension,"chest pain, fatigue, shortness of breath, cough, excessive salivation"
Hypertension,"excessive salivation, shortness of breath, chest pain, fatigue, cough"
Hyperthyroidism,"hair thinning, dehydration, weak muscles, insomnia, brittle nails"
Hyperthyroidism,"insomnia, brittle nails, weak muscles, dehydration, hair thinning"
Hyperthyroidism,"dehydration, hair thinning, brittle nails, weak muscles, insomnia"
Hyperthyroidism,"dehydration, brittle nails, hair thinning, weak muscles, insomnia"
Hyperthyroidism,"weak muscles, brittle nails, hair thinning, insomnia, dehydration"
Hyperthyroidism,"insomnia, weak muscles, brittle nails, dehydration, hair thinning"
Hyperthyroidism,"dehydration, hair thinning, weak muscles, brittle nails, insomnia"
Hyperthyroidism,"weak muscles, brittle nails, insomnia, dehydration, hair thinning"
Hyperthyroidism,"hair thinning, weak muscles, dehydration, insomnia, brittle nails"
Hyperthyroidism,"dehydration, weak muscles, hair thinning, brittle nails, insomnia"
Impetigo,"red sore around nose, high fever, blister, skin rash, yellow crust ooze"
Impetigo,"skin rash, high fever, blister, red sore around nose, yellow crust ooze"
Impetigo,"high fever, yellow crust ooze, skin rash, blister, red sore around nose"
Impetigo,"blister, skin rash, yellow crust ooze, red sore around nose, high fever"
Impetigo,"high fever, yellow crust ooze, blister, skin rash, red sore around nose"
Impetigo,"blister, high fever, skin rash, red sore around nose, yellow crust ooze"
Impetigo,"blister, high fever, red sore around nose, skin rash, yellow crust ooze"
Impetigo,"yellow crust ooze, blister, high fever, red sore around nose, skin rash"
Impetigo,"skin rash, high fever, red sore around nose, yellow crust ooze, blister"
Impetigo,"yellow crust ooze, blister, skin rash, red sore around nose, high fever"
Influenza,"anemia, chills, sweating, high fever, headache"
Influenza,"sweating, high fever, chills, headache, anemia"
Influenza,"sweating, headache, anemia, chills, high fever"
Influenza,"anemia, sweating, chills, headache, high fever"
Influenza,"high fever, headache, chills, anemia, sweating"
Influenza,"high fever, anemia, sweating, chills, headache"
Influenza,"chills, anemia, sweating, headache, high fever"
Influenza,"sweating, headache, high fever, chills, anemia"
Influenza,"anemia, chills, high fever, headache, sweating"
Influenza,"anemia, headache, high fever, chills, sweating"
Insomnia,"increased susceptibility to infections, chest pain, cough, shortness of breath, fatigue"
Insomnia,"chest pain, shortness of breath, increased susceptibility to infections, fatigue, cough"
Insomnia,"increased susceptibility to infections, shortness of breath, chest pain, cough, fatigue"
Insomnia,"shortness of breath, fatigue, increased susceptibility to infections, cough, chest pain"
Insomnia,"shortness of breath, increased susceptibility to infections, cough, chest pain, fatigue"
Insomnia,"chest pain, increased susceptibility to infections, shortness of breath, cough, fatigue"
Insomnia,"cough, shortness of breath, chest pain, fatigue, increased susceptibility to infections"
Insomnia,"increased susceptibility to infections, shortness of breath, cough, fatigue, chest pain"
Insomnia,"fatigue, chest pain, increased susceptibility to infections, cough, shortness of breath"
Irritable Bowel Syndrome (IBS),"depression, food intolerance, anxiety, weakness, cold hands"
Irritable Bowel Syndrome (IBS),"depression, cold hands, food intolerance, anxiety, weakness"
Irritable Bowel Syndrome (IBS),"cold hands, food intolerance, weakness, anxiety, depression"
Irritable Bowel Syndrome (IBS),"cold hands, anxiety, food intolerance, depression, weakness"
Irritable Bowel Syndrome (IBS),"anxiety, food intolerance, cold hands, weakness, depression"
Irritable Bowel Syndrome (IBS),"food intolerance, depression, cold hands, anxiety, weakness"
Irritable Bowel Syndrome (IBS),"depression, cold hands, anxiety, weakness, food intolerance"
Irritable Bowel Syndrome (IBS),"food intolerance, depression, anxiety, cold hands, weakness"
Irritable Bowel Syndrome (IBS),"food intolerance, depression, weakness, anxiety, cold hands"
Irritable Bowel Syndrome (IBS),"anxiety, weakness, depression, food intolerance, cold hands"
Jaundice,"fatigue, itching, vomiting, high fever, weight loss"
Jaundice,"itching, weight loss, high fever, vomiting, fatigue"
Jaundice,"weight loss, itching, high fever, vomiting, fatigue"
Jaundice,"high fever, fatigue, vomiting, weight loss, itching"
Jaundice,"vomiting, fatigue, weight loss, high fever, itching"
Jaundice,"itching, fatigue, vomiting, high fever, weight loss"
Jaundice,"itching, fatigue, high fever, weight loss, vomiting"
Jaundice,"high fever, fatigue, weight loss, itching, vomiting"
Jaundice,"itching, high fever, vomiting, fatigue, weight loss"
Jaundice,"vomiting, itching, fatigue, high fever, weight loss"
Kidney Stones,"sensitivity to light, painful urination, dehydration, weakness, cloudy urine"
Kidney Stones,"dehydration, sensitivity to light, cloudy urine, weakness, painful urination"
Kidney Stones,"weakness, painful urination, sensitivity to light, dehydration, cloudy urine"
Kidney Stones,"dehydration, sensitivity to light, weakness, painful urination, cloudy urine"
Kidney Stones,"painful urination, weakness, dehydration, cloudy urine, sensitivity to light"
Kidney Stones,"cloudy urine, dehydration, painful urination, sensitivity to light, weakness"
Kidney Stones,"cloudy urine, painful urination, sensitivity to light, weakness, dehydration"
Kidney Stones,"painful urination, sensitivity to light, cloudy urine, weakness, dehydration"
Kidney Stones,"weakness, sensitivity to light, cloudy urine, dehydration, painful urination"
Kidney Stones,"sensitivity to light, weakness, painful urination, cloudy urine, dehydration"
Legionnaires' Disease,"cough, confusion, high fever, chills, vomiting"
Legionnaires' Disease,"high fever, vomiting, cough, chills, confusion"
Legionnaires' Disease,"chills, high fever, vomiting, cough, confusion"
Legionnaires' Disease,"cough, high fever, chills, vomiting, confusion"
Legionnaires' Disease,"vomiting, confusion, high fever, chills, cough"
Legionnaires' Disease,"chills, cough, high fever, confusion, vomiting"
Legionnaires' Disease,"cough, confusion, chills, vomiting, high fever"
Legionnaires' Disease,"chills, cough, confusion, vomiting, high fever"
Legionnaires' Disease,"chills, confusion, vomiting, high fever, cough"
Legionnaires' Disease,"vomiting, confusion, cough, high fever, chills"
Leptospirosis,"muscle aches, red eyes, rash, kidney damage, fatigue"
Leptospirosis,"muscle aches, kidney damage, red eyes, fatigue, rash"
Leptospirosis,"fatigue, red eyes, rash, kidney damage, muscle aches"
Leptospirosis,"rash, fatigue, kidney damage, red eyes, muscle aches"
Leptospirosis,"kidney damage, fatigue, rash, red eyes, muscle aches"
Leptospirosis,"fatigue, red eyes, rash, muscle aches, kidney damage"
Leptospirosis,"kidney damage, rash, muscle aches, fatigue, red eyes"
Leptospirosis,"fatigue, rash, kidney damage, muscle aches, red eyes"
Leptospirosis,"fatigue, rash, red eyes, kidney damage, muscle aches"
Leptospirosis,"fatigue, red eyes, kidney damage, muscle aches, rash"
Leukemia,"yellowish skin, fever, night sweats, weight loss, fatigue"
Leukemia,"night sweats, weight loss, yellowish skin, fatigue, fever"
Leukemia,"fever, fatigue, night sweats, weight loss, yellowish skin"
Leukemia,"weight loss, fever, night sweats, fatigue, yellowish skin"
Leukemia,"yellowish skin, fatigue, night sweats, fever, weight loss"
Leukemia,"fever, night sweats, yellowish skin, fatigue, weight loss"
Leukemia,"yellowish skin, weight loss, fever, fatigue, night sweats"
Leukemia,"fatigue, fever, weight loss, yellowish skin, night sweats"
Leukemia,"night sweats, yellowish skin, fatigue, weight loss, fever"
Leukemia,"fatigue, weight loss, night sweats, yellowish skin, fever"
Lice Infestation,"itchy scalp, visible nits, red bumps on scalp, crawling sensation, fatigue"
Lice Infestation,"red bumps on scalp, fatigue, itchy scalp, visible nits, crawling sensation"
Lice Infestation,"red bumps on scalp, itchy scalp, visible nits, crawling sensation, fatigue"
Lice Infestation,"red bumps on scalp, crawling sensation, fatigue, visible nits, itchy scalp"
Lice Infestation,"red bumps on scalp, crawling sensation, fatigue, itchy scalp, visible nits"
Lice Infestation,"visible nits, fatigue, crawling sensation, itchy scalp, red bumps on scalp"
Lice Infestation,"visible nits, itchy scalp, fatigue, crawling sensation, red bumps on scalp"
Lice Infestation,"visible nits, fatigue, red bumps on scalp, itchy scalp, crawling sensation"
Lice Infestation,"visible nits, itchy scalp, crawling sensation, red bumps on scalp, fatigue"
Lice Infestation,"fatigue, crawling sensation, red bumps on scalp, visible nits, itchy scalp"
Liver Cirrhosis,"jaundice, abdominal swelling, easy bruising, loss of appetite, fatigue"
Liver Cirrhosis,"fatigue, easy bruising, jaundice, abdominal swelling, loss of appetite"
Liver Cirrhosis,"fatigue, abdominal swelling, loss of appetite, easy bruising, jaundice"
Liver Cirrhosis,"jaundice, fatigue, easy bruising, loss of appetite, abdominal swelling"
Liver Cirrhosis,"fatigue, jaundice, easy bruising, loss of appetite, abdominal swelling"
Liver Cirrhosis,"jaundice, abdominal swelling, fatigue, loss of appetite, easy bruising"
Liver Cirrhosis,"jaundice, easy bruising, loss of appetite, abdominal swelling, fatigue"
Liver Cirrhosis,"loss of appetite, abdominal swelling, fatigue, easy bruising, jaundice"
Liver Cirrhosis,"easy bruising, fatigue, loss of appetite, jaundice, abdominal swelling"
Liver Cirrhosis,"fatigue, easy bruising, abdominal swelling, jaundice, loss of appetite"
Loiasis,"eye pain, moving worms under skin, swelling in limbs, skin itching, loss of appetite"
Loiasis,"skin itching, moving worms under skin, swelling in limbs, loss of appetite, eye pain"
Loiasis,"moving worms under skin, swelling in limbs, eye pain, loss of appetite, skin itching"
Loiasis,"loss of appetite, moving worms under skin, skin itching, swelling in limbs, eye pain"
Loiasis,"eye pain, moving worms under skin, skin itching, swelling in limbs, loss of appetite"
Loiasis,"skin itching, eye pain, moving worms under skin, swelling in limbs, loss of appetite"
Loiasis,"skin itching, eye pain, swelling in limbs, moving worms under skin, loss of appetite"
Loiasis,"eye pain, loss of appetite, swelling in limbs, moving worms under skin, skin itching"
Loiasis,"eye pain, loss of appetite, moving worms under skin, swelling in limbs, skin itching"
Loiasis,"loss of appetite, eye pain, skin itching, moving worms under skin, swelling in limbs"
Lung Cancer,"coughing up blood, hoarseness, weight loss, persistent chest pain, loss of appetite"
Lung Cancer,"coughing up blood, persistent chest pain, hoarseness, loss of appetite, weight loss"
Lung Cancer,"loss of appetite, coughing up blood, hoarseness, persistent chest pain, weight loss"
Lung Cancer,"loss of appetite, hoarseness, persistent chest pain, weight loss, coughing up blood"
Lung Cancer,"persistent chest pain, hoarseness, weight loss, coughing up blood, loss of appetite"
Lung Cancer,"weight loss, hoarseness, coughing up blood, loss of appetite, persistent chest pain"
Lung Cancer,"loss of appetite, weight loss, persistent chest pain, hoarseness, coughing up blood"
Lung Cancer,"loss of appetite, hoarseness, persistent chest pain, coughing up blood, weight loss"
