Disease,Symptoms
Dermatitis,"confusion, scaling, blister, red itchy skin, dry patches"
Diabetes,"severe abdominal pain, chest pain, cough, shortness of breath, fatigue"
Diabetes,"chest pain, shortness of breath, cough, fatigue, severe abdominal pain"
Diabetes,"shortness of breath, chest pain, fatigue, cough, severe abdominal pain"
Diabetes,"severe abdominal pain, cough, chest pain, shortness of breath, fatigue"
Diabetes,"severe abdominal pain, shortness of breath, fatigue, chest pain, cough"
Diabetes,"chest pain, fatigue, shortness of breath, cough, severe abdominal pain"
Diabetes,"severe abdominal pain, shortness of breath, chest pain, cough, fatigue"
Diabetes,"fatigue, shortness of breath, severe abdominal pain, cough, chest pain"
Diabetes,"cough, shortness of breath, fatigue, chest pain, severe abdominal pain"
Diabetes,"cough, shortness of breath, chest pain, fatigue, severe abdominal pain"
Dimorphic hemmorhoids(piles),"irritation in anus, pain during bowel movements, constipation, pain in anal region, bloody stool"
Dimorphic hemmorhoids(piles),"pain in anal region, irritation in anus, bloody stool, pain during bowel movements, constipation"
Dimorphic hemmorhoids(piles),"pain during bowel movements, bloody stool, constipation, irritation in anus, pain in anal region"
Dimorphic hemmorhoids(piles),"irritation in anus, constipation, pain during bowel movements, pain in anal region, bloody stool"
Dimorphic hemmorhoids(piles),"constipation, pain during bowel movements, irritation in anus, bloody stool, pain in anal region"
Dimorphic hemmorhoids(piles),"bloody stool, pain during bowel movements, constipation, irritation in anus, pain in anal region"
Dimorphic hemmorhoids(piles),"constipation, pain in anal region, pain during bowel movements, bloody stool, irritation in anus"
Dimorphic hemmorhoids(piles),"pain during bowel movements, pain in anal region, constipation, irritation in anus, bloody stool"
Dimorphic hemmorhoids(piles),"pain during bowel movements, constipation, bloody stool, pain in anal region, irritation in anus"
Dimorphic hemmorhoids(piles),"pain during bowel movements, constipation, bloody stool, irritation in anus, pain in anal region"
Diphtheria,"sore throat, thick gray coating in throat, difficulty breathing, swollen neck, fatigue"
Diphtheria,"thick gray coating in throat, sore throat, difficulty breathing, fatigue, swollen neck"
Diphtheria,"thick gray coating in throat, swollen neck, sore throat, fatigue, difficulty breathing"
Diphtheria,"fatigue, swollen neck, difficulty breathing, thick gray coating in throat, sore throat"
Diphtheria,"swollen neck, difficulty breathing, sore throat, thick gray coating in throat, fatigue"
Diphtheria,"difficulty breathing, sore throat, swollen neck, fatigue, thick gray coating in throat"
Diphtheria,"fatigue, swollen neck, difficulty breathing, sore throat, thick gray coating in throat"
Diphtheria,"sore throat, difficulty breathing, fatigue, swollen neck, thick gray coating in throat"
Diphtheria,"sore throat, swollen neck, difficulty breathing, fatigue, thick gray coating in throat"
Diphtheria,"sore throat, swollen neck, difficulty breathing, thick gray coating in throat, fatigue"
Diverticulitis,"cramping, dehydration, weakness, rectal bleeding, chills"
Diverticulitis,"chills, cramping, rectal bleeding, weakness, dehydration"
Diverticulitis,"cramping, dehydration, chills, rectal bleeding, weakness"
Diverticulitis,"weakness, dehydration, cramping, rectal bleeding, chills"
Diverticulitis,"weakness, rectal bleeding, cramping, chills, dehydration"
Diverticulitis,"cramping, chills, rectal bleeding, weakness, dehydration"
Diverticulitis,"chills, dehydration, weakness, cramping, rectal bleeding"
Diverticulitis,"rectal bleeding, dehydration, chills, weakness, cramping"
Diverticulitis,"weakness, dehydration, rectal bleeding, chills, cramping"
Diverticulitis,"rectal bleeding, cramping, weakness, chills, dehydration"
Drug Reaction,"itching, burning micturition, stomach pain, skin rash, spotting  urination"
Drug Reaction,"itching, spotting  urination, skin rash, burning micturition, stomach pain"
Drug Reaction,"stomach pain, skin rash, itching, burning micturition, spotting  urination"
Drug Reaction,"stomach pain, burning micturition, itching, skin rash, spotting  urination"
Drug Reaction,"itching, stomach pain, burning micturition, spotting  urination, skin rash"
Drug Reaction,"stomach pain, skin rash, burning micturition, itching, spotting  urination"
Drug Reaction,"skin rash, itching, stomach pain, burning micturition, spotting  urination"
Drug Reaction,"stomach pain, skin rash, itching, spotting  urination, burning micturition"
Drug Reaction,"stomach pain, itching, skin rash, burning micturition, spotting  urination"
Drug Reaction,"stomach pain, skin rash, burning micturition, spotting  urination, itching"
E. Coli Infection,"family history, fever, night sweats, weight loss, fatigue"
E. Coli Infection,"fever, family history, weight loss, fatigue, night sweats"
E. Coli Infection,"night sweats, fatigue, family history, weight loss, fever"
E. Coli Infection,"fatigue, fever, family history, weight loss, night sweats"
E. Coli Infection,"night sweats, family history, weight loss, fever, fatigue"
E. Coli Infection,"night sweats, weight loss, fever, fatigue, family history"
E. Coli Infection,"night sweats, fatigue, fever, weight loss, family history"
E. Coli Infection,"fever, weight loss, night sweats, fatigue, family history"
E. Coli Infection,"fatigue, night sweats, family history, fever, weight loss"
E. Coli Infection,"fever, family history, weight loss, night sweats, fatigue"
Ebola,"indigestion, chills, sweating, high fever, headache"
Ebola,"indigestion, headache, high fever, sweating, chills"
Ebola,"high fever, headache, sweating, indigestion, chills"
Ebola,"sweating, headache, high fever, chills, indigestion"
Ebola,"indigestion, headache, chills, sweating, high fever"
Ebola,"chills, indigestion, headache, sweating, high fever"
Ebola,"sweating, indigestion, high fever, chills, headache"
Ebola,"high fever, headache, indigestion, sweating, chills"
Ebola,"indigestion, headache, chills, high fever, sweating"
Ebola,"high fever, sweating, headache, indigestion, chills"
Eczema,"crawling sensation, dehydration, low blood pressure, severe diarrhea, vomiting"
Eczema,"severe diarrhea, dehydration, vomiting, crawling sensation, low blood pressure"
Eczema,"dehydration, crawling sensation, vomiting, low blood pressure, severe diarrhea"
Eczema,"severe diarrhea, vomiting, crawling sensation, dehydration, low blood pressure"
Eczema,"crawling sensation, low blood pressure, vomiting, dehydration, severe diarrhea"
Eczema,"low blood pressure, vomiting, crawling sensation, dehydration, severe diarrhea"
Eczema,"severe diarrhea, dehydration, low blood pressure, crawling sensation, vomiting"
Eczema,"crawling sensation, dehydration, severe diarrhea, vomiting, low blood pressure"
Eczema,"severe diarrhea, low blood pressure, dehydration, crawling sensation, vomiting"
Eczema,"crawling sensation, severe diarrhea, dehydration, low blood pressure, vomiting"
Ehlers-Danlos Syndrome,"osteoporosis, joint dislocations, poor coordination, delayed wound healing, chronic fatigue"
Ehlers-Danlos Syndrome,"chronic fatigue, joint dislocations, poor coordination, osteoporosis, delayed wound healing"
Ehlers-Danlos Syndrome,"poor coordination, delayed wound healing, chronic fatigue, joint dislocations, osteoporosis"
Ehlers-Danlos Syndrome,"osteoporosis, delayed wound healing, joint dislocations, poor coordination, chronic fatigue"
Ehlers-Danlos Syndrome,"osteoporosis, joint dislocations, chronic fatigue, poor coordination, delayed wound healing"
Ehlers-Danlos Syndrome,"poor coordination, osteoporosis, joint dislocations, chronic fatigue, delayed wound healing"
Ehlers-Danlos Syndrome,"delayed wound healing, chronic fatigue, joint dislocations, poor coordination, osteoporosis"
Ehlers-Danlos Syndrome,"osteoporosis, delayed wound healing, poor coordination, joint dislocations, chronic fatigue"
Ehlers-Danlos Syndrome,"delayed wound healing, osteoporosis, poor coordination, chronic fatigue, joint dislocations"
Ehlers-Danlos Syndrome,"delayed wound healing, poor coordination, chronic fatigue, joint dislocations, osteoporosis"
Endometriosis,"headache, urinary urgency, heavy menstrual bleeding, pelvic pain, depression"
Endometriosis,"pelvic pain, depression, urinary urgency, headache, heavy menstrual bleeding"
Endometriosis,"depression, heavy menstrual bleeding, pelvic pain, headache, urinary urgency"
Endometriosis,"heavy menstrual bleeding, depression, pelvic pain, urinary urgency, headache"
Endometriosis,"headache, heavy menstrual bleeding, depression, pelvic pain, urinary urgency"
Endometriosis,"depression, urinary urgency, pelvic pain, headache, heavy menstrual bleeding"
Endometriosis,"depression, urinary urgency, heavy menstrual bleeding, headache, pelvic pain"
Endometriosis,"depression, headache, pelvic pain, heavy menstrual bleeding, urinary urgency"
Endometriosis,"headache, urinary urgency, pelvic pain, heavy menstrual bleeding, depression"
Endometriosis,"pelvic pain, urinary urgency, depression, headache, heavy menstrual bleeding"
Epilepsy,"sleepiness, cough, rapid eye blinking, aura sensation, temporary memory loss"
Epilepsy,"sleepiness, aura sensation, rapid eye blinking, temporary memory loss, cough"
Epilepsy,"temporary memory loss, sleepiness, rapid eye blinking, cough, aura sensation"
Epilepsy,"sleepiness, rapid eye blinking, temporary memory loss, aura sensation, cough"
Epilepsy,"sleepiness, cough, aura sensation, temporary memory loss, rapid eye blinking"
Epilepsy,"sleepiness, rapid eye blinking, cough, temporary memory loss, aura sensation"
Epilepsy,"sleepiness, temporary memory loss, rapid eye blinking, aura sensation, cough"
Epilepsy,"cough, rapid eye blinking, aura sensation, sleepiness, temporary memory loss"
Epilepsy,"rapid eye blinking, sleepiness, cough, temporary memory loss, aura sensation"
Epilepsy,"sleepiness, rapid eye blinking, cough, aura sensation, temporary memory loss"
Erectile Dysfunction,"delayed ejaculation, depression, pain during intercourse, anxiety, weakness"
Erectile Dysfunction,"pain during intercourse, weakness, anxiety, delayed ejaculation, depression"
Erectile Dysfunction,"delayed ejaculation, pain during intercourse, anxiety, weakness, depression"
Erectile Dysfunction,"delayed ejaculation, pain during intercourse, weakness, depression, anxiety"
Erectile Dysfunction,"pain during intercourse, weakness, anxiety, depression, delayed ejaculation"
Erectile Dysfunction,"anxiety, depression, weakness, pain during intercourse, delayed ejaculation"
Erectile Dysfunction,"depression, delayed ejaculation, anxiety, pain during intercourse, weakness"
Erectile Dysfunction,"delayed ejaculation, anxiety, pain during intercourse, weakness, depression"
Erectile Dysfunction,"anxiety, delayed ejaculation, pain during intercourse, weakness, depression"
Erectile Dysfunction,"depression, pain during intercourse, delayed ejaculation, weakness, anxiety"
Esophageal Cancer,"hoarseness, weakness, regurgitation, hiccups, persistent cough"
Esophageal Cancer,"hoarseness, weakness, regurgitation, persistent cough, hiccups"
Esophageal Cancer,"regurgitation, weakness, persistent cough, hiccups, hoarseness"
Esophageal Cancer,"hiccups, persistent cough, weakness, hoarseness, regurgitation"
Esophageal Cancer,"weakness, hiccups, persistent cough, hoarseness, regurgitation"
Esophageal Cancer,"regurgitation, hiccups, persistent cough, weakness, hoarseness"
Esophageal Cancer,"hiccups, persistent cough, hoarseness, regurgitation, weakness"
Esophageal Cancer,"persistent cough, regurgitation, hoarseness, weakness, hiccups"
Esophageal Cancer,"hiccups, regurgitation, persistent cough, hoarseness, weakness"
Esophageal Cancer,"hiccups, regurgitation, weakness, hoarseness, persistent cough"
Fatty Liver Disease,"cough, weakness, chronic fatigue, enlarged liver, jaundice"
Fatty Liver Disease,"chronic fatigue, cough, jaundice, enlarged liver, weakness"
Fatty Liver Disease,"weakness, enlarged liver, jaundice, chronic fatigue, cough"
Fatty Liver Disease,"enlarged liver, weakness, chronic fatigue, cough, jaundice"
Fatty Liver Disease,"enlarged liver, jaundice, chronic fatigue, cough, weakness"
Fatty Liver Disease,"chronic fatigue, jaundice, cough, weakness, enlarged liver"
Fatty Liver Disease,"cough, jaundice, weakness, chronic fatigue, enlarged liver"
Fatty Liver Disease,"weakness, cough, jaundice, chronic fatigue, enlarged liver"
Fatty Liver Disease,"enlarged liver, jaundice, chronic fatigue, weakness, cough"
Fatty Liver Disease,"jaundice, enlarged liver, cough, chronic fatigue, weakness"
Fibromyalgia,"widespread body pain, sleep disturbances, depression, headache, fatigue"
Fibromyalgia,"widespread body pain, headache, sleep disturbances, fatigue, depression"
Fibromyalgia,"widespread body pain, fatigue, headache, depression, sleep disturbances"
Fibromyalgia,"fatigue, headache, widespread body pain, depression, sleep disturbances"
Fibromyalgia,"depression, widespread body pain, fatigue, sleep disturbances, headache"
Fibromyalgia,"headache, widespread body pain, fatigue, sleep disturbances, depression"
Fibromyalgia,"fatigue, widespread body pain, depression, sleep disturbances, headache"
Fibromyalgia,"fatigue, headache, depression, widespread body pain, sleep disturbances"
Fibromyalgia,"sleep disturbances, fatigue, headache, widespread body pain, depression"
Fibromyalgia,"headache, sleep disturbances, depression, fatigue, widespread body pain"
Filariasis,"visual disturbances, chest pain, cough, shortness of breath, fatigue"
Filariasis,"chest pain, visual disturbances, shortness of breath, cough, fatigue"
Filariasis,"cough, visual disturbances, fatigue, shortness of breath, chest pain"
Filariasis,"fatigue, visual disturbances, chest pain, shortness of breath, cough"
Filariasis,"shortness of breath, cough, visual disturbances, fatigue, chest pain"
Filariasis,"cough, shortness of breath, chest pain, fatigue, visual disturbances"
Filariasis,"shortness of breath, chest pain, fatigue, cough, visual disturbances"
Filariasis,"cough, fatigue, visual disturbances, chest pain, shortness of breath"
Filariasis,"cough, visual disturbances, chest pain, shortness of breath, fatigue"
Filariasis,"chest pain, cough, visual disturbances, fatigue, shortness of breath"
Fungal infection,"dischromic  patches, skin rash, itching, nodal skin eruptions, peeling skin"
Fungal infection,"itching, nodal skin eruptions, skin rash, peeling skin, dischromic  patches"
Fungal infection,"skin rash, nodal skin eruptions, itching, peeling skin, dischromic  patches"
Fungal infection,"skin rash, nodal skin eruptions, itching, dischromic  patches, peeling skin"
Fungal infection,"nodal skin eruptions, dischromic  patches, skin rash, peeling skin, itching"
Fungal infection,"itching, skin rash, peeling skin, nodal skin eruptions, dischromic  patches"
Fungal infection,"skin rash, peeling skin, itching, nodal skin eruptions, dischromic  patches"
Fungal infection,"skin rash, peeling skin, nodal skin eruptions, dischromic  patches, itching"
Fungal infection,"peeling skin, itching, skin rash, nodal skin eruptions, dischromic  patches"
Fungal infection,"skin rash, itching, peeling skin, nodal skin eruptions, dischromic  patches"
GERD,"ulcers on tongue, vomiting, cough, acidity, stomach pain"
GERD,"acidity, stomach pain, vomiting, cough, ulcers on tongue"
GERD,"acidity, ulcers on tongue, vomiting, stomach pain, cough"
GERD,"ulcers on tongue, stomach pain, acidity, cough, vomiting"
GERD,"vomiting, stomach pain, ulcers on tongue, cough, acidity"
GERD,"stomach pain, cough, acidity, vomiting, ulcers on tongue"
GERD,"ulcers on tongue, acidity, stomach pain, vomiting, cough"
GERD,"vomiting, ulcers on tongue, acidity, cough, stomach pain"
GERD,"cough, stomach pain, vomiting, ulcers on tongue, acidity"
Gallbladder Disease,"weakness, severe abdominal pain, jaundice, right shoulder pain, indigestion"
Gallbladder Disease,"jaundice, right shoulder pain, severe abdominal pain, indigestion, weakness"
Gallbladder Disease,"jaundice, weakness, indigestion, severe abdominal pain, right shoulder pain"
Gallbladder Disease,"right shoulder pain, indigestion, jaundice, weakness, severe abdominal pain"
Gallbladder Disease,"right shoulder pain, severe abdominal pain, weakness, indigestion, jaundice"
Gallbladder Disease,"weakness, right shoulder pain, indigestion, severe abdominal pain, jaundice"
Gallbladder Disease,"jaundice, indigestion, severe abdominal pain, right shoulder pain, weakness"
Gallbladder Disease,"indigestion, jaundice, right shoulder pain, severe abdominal pain, weakness"
Gallbladder Disease,"jaundice, severe abdominal pain, indigestion, weakness, right shoulder pain"
Gallbladder Disease,"severe abdominal pain, right shoulder pain, weakness, indigestion, jaundice"
Gallstones,"abdominal pain, nausea, vomiting, jaundice, indigestion"
Gallstones,"vomiting, indigestion, nausea, abdominal pain, jaundice"
Gallstones,"indigestion, jaundice, nausea, abdominal pain, vomiting"
Gallstones,"abdominal pain, indigestion, vomiting, jaundice, nausea"
Gallstones,"nausea, abdominal pain, jaundice, indigestion, vomiting"
Gallstones,"nausea, abdominal pain, jaundice, vomiting, indigestion"
Gallstones,"jaundice, vomiting, abdominal pain, nausea, indigestion"
Gallstones,"nausea, indigestion, vomiting, abdominal pain, jaundice"
Gallstones,"jaundice, vomiting, indigestion, nausea, abdominal pain"
Gallstones,"vomiting, nausea, abdominal pain, jaundice, indigestion"
Gastric Cancer,"bloating after eating, stomach pain, nausea, black stool, fatigue"
Gastric Cancer,"black stool, nausea, fatigue, stomach pain, bloating after eating"
Gastric Cancer,"stomach pain, nausea, bloating after eating, black stool, fatigue"
Gastric Cancer,"nausea, fatigue, black stool, bloating after eating, stomach pain"
Gastric Cancer,"nausea, bloating after eating, black stool, stomach pain, fatigue"
Gastric Cancer,"nausea, fatigue, stomach pain, bloating after eating, black stool"
Gastric Cancer,"stomach pain, fatigue, bloating after eating, nausea, black stool"
Gastric Cancer,"bloating after eating, stomach pain, fatigue, black stool, nausea"
Gastric Cancer,"bloating after eating, black stool, fatigue, stomach pain, nausea"
Gastric Cancer,"stomach pain, black stool, bloating after eating, fatigue, nausea"
Gastritis,"dry mouth, weakness, hiccups, chest discomfort, acid reflux"
Gastritis,"acid reflux, dry mouth, weakness, hiccups, chest discomfort"
Gastritis,"dry mouth, chest discomfort, hiccups, weakness, acid reflux"
Gastritis,"acid reflux, hiccups, chest discomfort, dry mouth, weakness"
Gastritis,"chest discomfort, weakness, acid reflux, dry mouth, hiccups"
Gastritis,"weakness, acid reflux, chest discomfort, dry mouth, hiccups"
Gastritis,"acid reflux, dry mouth, chest discomfort, weakness, hiccups"
Gastritis,"hiccups, dry mouth, weakness, chest discomfort, acid reflux"
Gastritis,"dry mouth, hiccups, weakness, acid reflux, chest discomfort"
Gastritis,"chest discomfort, hiccups, acid reflux, weakness, dry mouth"
Gastroenteritis,"dry mouth, dehydration, weakness, watery diarrhea, diarrhoea"
Gastroenteritis,"weakness, diarrhoea, dry mouth, watery diarrhea, dehydration"
Gastroenteritis,"dehydration, watery diarrhea, diarrhoea, weakness, dry mouth"
Gastroenteritis,"dehydration, dry mouth, watery diarrhea, diarrhoea, weakness"
Gastroenteritis,"diarrhoea, dehydration, dry mouth, watery diarrhea, weakness"
Gastroenteritis,"weakness, diarrhoea, watery diarrhea, dry mouth, dehydration"
Gastroenteritis,"watery diarrhea, diarrhoea, weakness, dehydration, dry mouth"
Gastroenteritis,"watery diarrhea, weakness, dry mouth, dehydration, diarrhoea"
Gastroenteritis,"dry mouth, weakness, diarrhoea, dehydration, watery diarrhea"
Gastroenteritis,"watery diarrhea, weakness, dehydration, dry mouth, diarrhoea"
Giardiasis,"stomach pain, dehydration, low blood pressure, severe diarrhea, vomiting"
Giardiasis,"dehydration, stomach pain, severe diarrhea, vomiting, low blood pressure"
Giardiasis,"dehydration, severe diarrhea, low blood pressure, vomiting, stomach pain"
Giardiasis,"severe diarrhea, stomach pain, dehydration, low blood pressure, vomiting"
Giardiasis,"dehydration, low blood pressure, stomach pain, severe diarrhea, vomiting"
Giardiasis,"low blood pressure, stomach pain, vomiting, severe diarrhea, dehydration"
Giardiasis,"low blood pressure, dehydration, vomiting, severe diarrhea, stomach pain"
Giardiasis,"low blood pressure, dehydration, vomiting, stomach pain, severe diarrhea"
Giardiasis,"severe diarrhea, dehydration, stomach pain, vomiting, low blood pressure"
Giardiasis,"severe diarrhea, vomiting, stomach pain, dehydration, low blood pressure"
Glaucoma,"night blindness, cough, eye pain, eye fatigue, difficulty adjusting to darkness"
Glaucoma,"eye pain, difficulty adjusting to darkness, eye fatigue, night blindness, cough"
Glaucoma,"eye fatigue, difficulty adjusting to darkness, eye pain, night blindness, cough"
Glaucoma,"night blindness, difficulty adjusting to darkness, eye fatigue, eye pain, cough"
Glaucoma,"eye pain, night blindness, difficulty adjusting to darkness, cough, eye fatigue"
Glaucoma,"eye fatigue, cough, difficulty adjusting to darkness, eye pain, night blindness"
Glaucoma,"eye fatigue, cough, night blindness, difficulty adjusting to darkness, eye pain"
Glaucoma,"difficulty adjusting to darkness, eye fatigue, eye pain, cough, night blindness"
Glaucoma,"difficulty adjusting to darkness, cough, night blindness, eye fatigue, eye pain"
Glaucoma,"cough, eye fatigue, night blindness, difficulty adjusting to darkness, eye pain"
Gonorrhea,"burning urination, unusual genital discharge, pelvic pain, painful intercourse, vomiting"
Gonorrhea,"unusual genital discharge, burning urination, vomiting, pelvic pain, painful intercourse"
Gonorrhea,"pelvic pain, unusual genital discharge, burning urination, vomiting, painful intercourse"
Gonorrhea,"painful intercourse, burning urination, unusual genital discharge, pelvic pain, vomiting"
Gonorrhea,"painful intercourse, unusual genital discharge, pelvic pain, vomiting, burning urination"
Gonorrhea,"pelvic pain, unusual genital discharge, burning urination, painful intercourse, vomiting"
Gonorrhea,"vomiting, painful intercourse, unusual genital discharge, pelvic pain, burning urination"
Gonorrhea,"burning urination, vomiting, pelvic pain, painful intercourse, unusual genital discharge"
Gonorrhea,"painful intercourse, vomiting, unusual genital discharge, pelvic pain, burning urination"
Gonorrhea,"pelvic pain, vomiting, painful intercourse, unusual genital discharge, burning urination"
Gout,"joint swelling, intense pain, redness, warmth in affected joint, headache"
Gout,"redness, joint swelling, headache, intense pain, warmth in affected joint"
Gout,"warmth in affected joint, joint swelling, headache, redness, intense pain"
Gout,"joint swelling, warmth in affected joint, intense pain, headache, redness"
Gout,"redness, intense pain, warmth in affected joint, headache, joint swelling"
Gout,"headache, redness, warmth in affected joint, intense pain, joint swelling"
Gout,"joint swelling, redness, headache, intense pain, warmth in affected joint"
Gout,"redness, intense pain, headache, warmth in affected joint, joint swelling"
Gout,"redness, warmth in affected joint, headache, intense pain, joint swelling"
Gout,"redness, headache, joint swelling, warmth in affected joint, intense pain"
Graves' Disease,"hair thinning, anxiety, insomnia, brittle nails, bulging eyes"
Graves' Disease,"hair thinning, insomnia, brittle nails, anxiety, bulging eyes"
Graves' Disease,"anxiety, bulging eyes, brittle nails, insomnia, hair thinning"
Graves' Disease,"insomnia, anxiety, bulging eyes, brittle nails, hair thinning"
Graves' Disease,"insomnia, bulging eyes, hair thinning, brittle nails, anxiety"
Graves' Disease,"brittle nails, hair thinning, bulging eyes, insomnia, anxiety"
Graves' Disease,"brittle nails, anxiety, bulging eyes, insomnia, hair thinning"
Graves' Disease,"hair thinning, anxiety, brittle nails, insomnia, bulging eyes"
Graves' Disease,"brittle nails, bulging eyes, anxiety, insomnia, hair thinning"
Graves' Disease,"brittle nails, insomnia, bulging eyes, anxiety, hair thinning"
Guillain Barre Syndrome,"loss of reflexes, difficulty breathing, weakness, low blood pressure, coordination issues"
Guillain Barre Syndrome,"low blood pressure, loss of reflexes, coordination issues, weakness, difficulty breathing"
Guillain Barre Syndrome,"coordination issues, low blood pressure, weakness, loss of reflexes, difficulty breathing"
Guillain Barre Syndrome,"coordination issues, low blood pressure, weakness, difficulty breathing, loss of reflexes"
Guillain Barre Syndrome,"weakness, low blood pressure, loss of reflexes, coordination issues, difficulty breathing"
Guillain Barre Syndrome,"coordination issues, low blood pressure, difficulty breathing, loss of reflexes, weakness"
Guillain Barre Syndrome,"difficulty breathing, coordination issues, weakness, loss of reflexes, low blood pressure"
Guillain Barre Syndrome,"loss of reflexes, low blood pressure, coordination issues, difficulty breathing, weakness"
Guillain Barre Syndrome,"weakness, low blood pressure, difficulty breathing, loss of reflexes, coordination issues"
HIV/AIDS,"swollen lymph nodes, night sweats, mouth ulcers, weight loss, confusion"
HIV/AIDS,"swollen lymph nodes, mouth ulcers, night sweats, confusion, weight loss"
HIV/AIDS,"mouth ulcers, confusion, swollen lymph nodes, weight loss, night sweats"
HIV/AIDS,"confusion, weight loss, swollen lymph nodes, night sweats, mouth ulcers"
