Disease,Symptoms
AIDS,"extra marital contacts, high fever, muscle wasting, patches in throat, weight loss"
AIDS,"extra marital contacts, patches in throat, weight loss, muscle wasting, high fever"
AIDS,"extra marital contacts, patches in throat, muscle wasting, high fever, weight loss"
AIDS,"weight loss, patches in throat, extra marital contacts, high fever, muscle wasting"
AIDS,"patches in throat, high fever, weight loss, extra marital contacts, muscle wasting"
AIDS,"weight loss, high fever, muscle wasting, patches in throat, extra marital contacts"
AIDS,"muscle wasting, extra marital contacts, patches in throat, high fever, weight loss"
AIDS,"muscle wasting, weight loss, high fever, extra marital contacts, patches in throat"
AIDS,"muscle wasting, weight loss, patches in throat, extra marital contacts, high fever"
AIDS,"weight loss, extra marital contacts, patches in throat, muscle wasting, high fever"
ALS (Amyotrophic Lateral Sclerosis),"muscle weakness, difficulty speaking, twitching, difficulty swallowing, headache"
ALS (Amyotrophic Lateral Sclerosis),"twitching, difficulty swallowing, difficulty speaking, muscle weakness, headache"
ALS (Amyotrophic Lateral Sclerosis),"difficulty speaking, difficulty swallowing, twitching, muscle weakness, headache"
ALS (Amyotrophic Lateral Sclerosis),"twitching, difficulty speaking, headache, muscle weakness, difficulty swallowing"
ALS (Amyotrophic Lateral Sclerosis),"difficulty swallowing, twitching, headache, muscle weakness, difficulty speaking"
ALS (Amyotrophic Lateral Sclerosis),"difficulty swallowing, difficulty speaking, muscle weakness, headache, twitching"
ALS (Amyotrophic Lateral Sclerosis),"headache, twitching, difficulty swallowing, muscle weakness, difficulty speaking"
ALS (Amyotrophic Lateral Sclerosis),"muscle weakness, headache, difficulty speaking, difficulty swallowing, twitching"
ALS (Amyotrophic Lateral Sclerosis),"difficulty swallowing, twitching, difficulty speaking, muscle weakness, headache"
ALS (Amyotrophic Lateral Sclerosis),"difficulty speaking, headache, muscle weakness, difficulty swallowing, twitching"
Acne,"pus filled pimples, blackheads, skin rash, scurring, red spots on skin"
Acne,"pus filled pimples, skin rash, scurring, blackheads, red spots on skin"
Acne,"pus filled pimples, red spots on skin, blackheads, skin rash, scurring"
Acne,"skin rash, blackheads, pus filled pimples, scurring, red spots on skin"
Acne,"scurring, pus filled pimples, skin rash, red spots on skin, blackheads"
Acne,"scurring, red spots on skin, blackheads, skin rash, pus filled pimples"
Acne,"red spots on skin, skin rash, pus filled pimples, scurring, blackheads"
Acne,"blackheads, pus filled pimples, red spots on skin, skin rash, scurring"
Acne,"scurring, blackheads, red spots on skin, skin rash, pus filled pimples"
Acne,"blackheads, scurring, skin rash, pus filled pimples, red spots on skin"
Acute Bronchitis,"hoarseness, tightness in chest, persistent cough, chest discomfort, runny nose"
Acute Bronchitis,"chest discomfort, hoarseness, runny nose, persistent cough, tightness in chest"
Acute Bronchitis,"hoarseness, tightness in chest, chest discomfort, persistent cough, runny nose"
Acute Bronchitis,"hoarseness, persistent cough, tightness in chest, runny nose, chest discomfort"
Acute Bronchitis,"hoarseness, runny nose, tightness in chest, chest discomfort, persistent cough"
Acute Bronchitis,"persistent cough, runny nose, hoarseness, chest discomfort, tightness in chest"
Acute Bronchitis,"runny nose, chest discomfort, persistent cough, hoarseness, tightness in chest"
Acute Bronchitis,"chest discomfort, hoarseness, tightness in chest, persistent cough, runny nose"
Acute Bronchitis,"persistent cough, hoarseness, chest discomfort, tightness in chest, runny nose"
Acute Bronchitis,"hoarseness, persistent cough, chest discomfort, runny nose, tightness in chest"
Addison's Disease,"depression, darkened skin, dehydration, muscle weakness, jaundice"
Addison's Disease,"depression, muscle weakness, dehydration, darkened skin, jaundice"
Addison's Disease,"muscle weakness, dehydration, depression, jaundice, darkened skin"
Addison's Disease,"jaundice, darkened skin, dehydration, depression, muscle weakness"
Addison's Disease,"depression, darkened skin, muscle weakness, jaundice, dehydration"
Addison's Disease,"jaundice, darkened skin, muscle weakness, dehydration, depression"
Addison's Disease,"muscle weakness, darkened skin, dehydration, depression, jaundice"
Addison's Disease,"darkened skin, depression, jaundice, muscle weakness, dehydration"
Addison's Disease,"dehydration, jaundice, muscle weakness, darkened skin, depression"
Addison's Disease,"darkened skin, depression, dehydration, muscle weakness, jaundice"
Alcoholic hepatitis,"vomiting, yellowish skin, abdominal pain, distention of abdomen, swelling of stomach"
Alcoholic hepatitis,"vomiting, distention of abdomen, yellowish skin, abdominal pain, swelling of stomach"
Alcoholic hepatitis,"vomiting, swelling of stomach, yellowish skin, distention of abdomen, abdominal pain"
Alcoholic hepatitis,"distention of abdomen, vomiting, yellowish skin, swelling of stomach, abdominal pain"
Alcoholic hepatitis,"abdominal pain, yellowish skin, swelling of stomach, distention of abdomen, vomiting"
Alcoholic hepatitis,"swelling of stomach, distention of abdomen, yellowish skin, vomiting, abdominal pain"
Alcoholic hepatitis,"yellowish skin, abdominal pain, vomiting, swelling of stomach, distention of abdomen"
Alcoholic hepatitis,"vomiting, swelling of stomach, abdominal pain, yellowish skin, distention of abdomen"
Alcoholic hepatitis,"distention of abdomen, abdominal pain, swelling of stomach, vomiting, yellowish skin"
Alcoholic hepatitis,"distention of abdomen, abdominal pain, vomiting, swelling of stomach, yellowish skin"
Allergy,"shivering, watering from eyes, chills, continuous sneezing, runny nose"
Allergy,"runny nose, chills, continuous sneezing, shivering, watering from eyes"
Allergy,"runny nose, shivering, watering from eyes, chills, continuous sneezing"
Allergy,"runny nose, watering from eyes, shivering, chills, continuous sneezing"
Allergy,"chills, runny nose, watering from eyes, continuous sneezing, shivering"
Allergy,"watering from eyes, runny nose, chills, continuous sneezing, shivering"
Allergy,"chills, shivering, watering from eyes, continuous sneezing, runny nose"
Allergy,"chills, watering from eyes, continuous sneezing, runny nose, shivering"
Allergy,"watering from eyes, shivering, chills, continuous sneezing, runny nose"
Allergy,"watering from eyes, shivering, continuous sneezing, chills, runny nose"
Alzheimer's Disease,"uncontrollable leg movement, fever, night sweats, weight loss, fatigue"
Alzheimer's Disease,"night sweats, uncontrollable leg movement, fatigue, weight loss, fever"
Alzheimer's Disease,"night sweats, fatigue, uncontrollable leg movement, fever, weight loss"
Alzheimer's Disease,"fatigue, night sweats, uncontrollable leg movement, fever, weight loss"
Alzheimer's Disease,"fatigue, fever, weight loss, uncontrollable leg movement, night sweats"
Alzheimer's Disease,"weight loss, fever, night sweats, uncontrollable leg movement, fatigue"
Alzheimer's Disease,"uncontrollable leg movement, night sweats, fever, fatigue, weight loss"
Alzheimer's Disease,"fever, uncontrollable leg movement, fatigue, weight loss, night sweats"
Alzheimer's Disease,"uncontrollable leg movement, weight loss, fever, night sweats, fatigue"
Alzheimer's Disease,"weight loss, uncontrollable leg movement, night sweats, fever, fatigue"
Amebiasis,"swollen salivary glands, cough, mucus production, wheezing, fatigue"
Amebiasis,"swollen salivary glands, mucus production, cough, wheezing, fatigue"
Amebiasis,"wheezing, cough, swollen salivary glands, mucus production, fatigue"
Amebiasis,"cough, mucus production, wheezing, fatigue, swollen salivary glands"
Amebiasis,"wheezing, cough, swollen salivary glands, fatigue, mucus production"
Amebiasis,"swollen salivary glands, mucus production, fatigue, cough, wheezing"
Amebiasis,"mucus production, swollen salivary glands, cough, wheezing, fatigue"
Amebiasis,"cough, mucus production, wheezing, swollen salivary glands, fatigue"
Amebiasis,"cough, mucus production, fatigue, swollen salivary glands, wheezing"
Amyotrophic Lateral Sclerosis (ALS),"loss of grip strength, impaired reflexes, stiff muscles, muscle weakness, clumsiness"
Amyotrophic Lateral Sclerosis (ALS),"clumsiness, impaired reflexes, stiff muscles, loss of grip strength, muscle weakness"
Amyotrophic Lateral Sclerosis (ALS),"muscle weakness, clumsiness, stiff muscles, impaired reflexes, loss of grip strength"
Amyotrophic Lateral Sclerosis (ALS),"impaired reflexes, loss of grip strength, clumsiness, stiff muscles, muscle weakness"
Amyotrophic Lateral Sclerosis (ALS),"stiff muscles, clumsiness, muscle weakness, impaired reflexes, loss of grip strength"
Amyotrophic Lateral Sclerosis (ALS),"impaired reflexes, stiff muscles, clumsiness, loss of grip strength, muscle weakness"
Amyotrophic Lateral Sclerosis (ALS),"clumsiness, impaired reflexes, muscle weakness, loss of grip strength, stiff muscles"
Amyotrophic Lateral Sclerosis (ALS),"stiff muscles, loss of grip strength, muscle weakness, clumsiness, impaired reflexes"
Amyotrophic Lateral Sclerosis (ALS),"impaired reflexes, clumsiness, stiff muscles, muscle weakness, loss of grip strength"
Amyotrophic Lateral Sclerosis (ALS),"clumsiness, impaired reflexes, loss of grip strength, stiff muscles, muscle weakness"
Anemia,"pale skin, shortness of breath, dizziness, cold hands and feet, vomiting"
Anemia,"shortness of breath, vomiting, cold hands and feet, pale skin, dizziness"
Anemia,"pale skin, cold hands and feet, shortness of breath, dizziness, vomiting"
Anemia,"shortness of breath, dizziness, cold hands and feet, vomiting, pale skin"
Anemia,"pale skin, dizziness, cold hands and feet, shortness of breath, vomiting"
Anemia,"dizziness, shortness of breath, cold hands and feet, vomiting, pale skin"
Anemia,"pale skin, vomiting, dizziness, cold hands and feet, shortness of breath"
Anemia,"pale skin, vomiting, shortness of breath, dizziness, cold hands and feet"
Anemia,"dizziness, vomiting, cold hands and feet, shortness of breath, pale skin"
Anemia,"vomiting, dizziness, pale skin, cold hands and feet, shortness of breath"
Aneurysm,"sensitivity to light, neck pain, speech difficulty, drooping eyelids, difficulty speaking"
Aneurysm,"neck pain, difficulty speaking, sensitivity to light, speech difficulty, drooping eyelids"
Aneurysm,"difficulty speaking, speech difficulty, neck pain, sensitivity to light, drooping eyelids"
Aneurysm,"drooping eyelids, neck pain, difficulty speaking, speech difficulty, sensitivity to light"
Aneurysm,"difficulty speaking, speech difficulty, sensitivity to light, drooping eyelids, neck pain"
Aneurysm,"difficulty speaking, drooping eyelids, neck pain, speech difficulty, sensitivity to light"
Aneurysm,"difficulty speaking, speech difficulty, neck pain, drooping eyelids, sensitivity to light"
Aneurysm,"sensitivity to light, drooping eyelids, neck pain, difficulty speaking, speech difficulty"
Aneurysm,"neck pain, drooping eyelids, difficulty speaking, speech difficulty, sensitivity to light"
Aneurysm,"sensitivity to light, neck pain, difficulty speaking, speech difficulty, drooping eyelids"
Anthrax,"round face, cough, mucus production, wheezing, fatigue"
Anthrax,"round face, wheezing, cough, fatigue, mucus production"
Anthrax,"mucus production, round face, wheezing, fatigue, cough"
Anthrax,"round face, fatigue, wheezing, cough, mucus production"
Anthrax,"fatigue, mucus production, round face, wheezing, cough"
Anthrax,"fatigue, cough, mucus production, round face, wheezing"
Anthrax,"round face, wheezing, fatigue, cough, mucus production"
Anthrax,"mucus production, wheezing, cough, round face, fatigue"
Anthrax,"round face, cough, wheezing, mucus production, fatigue"
Anthrax,"cough, mucus production, fatigue, round face, wheezing"
Aplastic Anemia,"heavy menstrual bleeding, increased susceptibility to infections, weakness, insomnia, small red spots on skin"
Aplastic Anemia,"weakness, increased susceptibility to infections, small red spots on skin, insomnia, heavy menstrual bleeding"
Aplastic Anemia,"small red spots on skin, insomnia, increased susceptibility to infections, weakness, heavy menstrual bleeding"
Aplastic Anemia,"increased susceptibility to infections, weakness, small red spots on skin, heavy menstrual bleeding, insomnia"
Aplastic Anemia,"small red spots on skin, insomnia, heavy menstrual bleeding, increased susceptibility to infections, weakness"
Aplastic Anemia,"weakness, heavy menstrual bleeding, insomnia, small red spots on skin, increased susceptibility to infections"
Aplastic Anemia,"increased susceptibility to infections, small red spots on skin, weakness, heavy menstrual bleeding, insomnia"
Aplastic Anemia,"increased susceptibility to infections, weakness, insomnia, small red spots on skin, heavy menstrual bleeding"
Aplastic Anemia,"insomnia, heavy menstrual bleeding, small red spots on skin, increased susceptibility to infections, weakness"
Aplastic Anemia,"increased susceptibility to infections, small red spots on skin, weakness, insomnia, heavy menstrual bleeding"
Appendicitis,"cramping, right-side pain, sharp lower abdominal pain, loss of energy, lack of hunger"
Appendicitis,"lack of hunger, right-side pain, cramping, loss of energy, sharp lower abdominal pain"
Appendicitis,"right-side pain, sharp lower abdominal pain, loss of energy, lack of hunger, cramping"
Appendicitis,"cramping, sharp lower abdominal pain, lack of hunger, loss of energy, right-side pain"
Appendicitis,"sharp lower abdominal pain, right-side pain, cramping, loss of energy, lack of hunger"
Appendicitis,"loss of energy, lack of hunger, cramping, sharp lower abdominal pain, right-side pain"
Appendicitis,"loss of energy, right-side pain, sharp lower abdominal pain, cramping, lack of hunger"
Appendicitis,"cramping, right-side pain, lack of hunger, sharp lower abdominal pain, loss of energy"
Appendicitis,"cramping, lack of hunger, sharp lower abdominal pain, right-side pain, loss of energy"
Appendicitis,"sharp lower abdominal pain, lack of hunger, cramping, loss of energy, right-side pain"
Arthritis,"stiff neck, swelling joints, muscle weakness, movement stiffness, painful walking"
Arthritis,"painful walking, movement stiffness, swelling joints, stiff neck, muscle weakness"
Arthritis,"painful walking, muscle weakness, swelling joints, movement stiffness, stiff neck"
Arthritis,"muscle weakness, movement stiffness, painful walking, swelling joints, stiff neck"
Arthritis,"stiff neck, muscle weakness, swelling joints, movement stiffness, painful walking"
Arthritis,"painful walking, swelling joints, movement stiffness, stiff neck, muscle weakness"
Arthritis,"stiff neck, painful walking, muscle weakness, swelling joints, movement stiffness"
Arthritis,"muscle weakness, swelling joints, painful walking, movement stiffness, stiff neck"
Arthritis,"movement stiffness, muscle weakness, painful walking, stiff neck, swelling joints"
Arthritis,"swelling joints, muscle weakness, stiff neck, painful walking, movement stiffness"
Aspergillosis,"unusual genital discharge, fever, night sweats, weight loss, fatigue"
Aspergillosis,"unusual genital discharge, night sweats, fever, weight loss, fatigue"
Aspergillosis,"fever, weight loss, unusual genital discharge, fatigue, night sweats"
Aspergillosis,"fever, unusual genital discharge, weight loss, fatigue, night sweats"
Aspergillosis,"night sweats, fever, unusual genital discharge, weight loss, fatigue"
Aspergillosis,"weight loss, night sweats, fever, unusual genital discharge, fatigue"
Aspergillosis,"weight loss, fatigue, unusual genital discharge, fever, night sweats"
Aspergillosis,"fatigue, unusual genital discharge, fever, weight loss, night sweats"
Aspergillosis,"fever, fatigue, weight loss, night sweats, unusual genital discharge"
Aspergillosis,"fever, weight loss, night sweats, fatigue, unusual genital discharge"
Asthma,"shortness of breath, chest tightness, wheezing, nighttime coughing, headache"
Asthma,"chest tightness, headache, nighttime coughing, wheezing, shortness of breath"
Asthma,"chest tightness, shortness of breath, wheezing, nighttime coughing, headache"
Asthma,"chest tightness, headache, wheezing, shortness of breath, nighttime coughing"
Asthma,"wheezing, chest tightness, nighttime coughing, headache, shortness of breath"
Asthma,"headache, wheezing, nighttime coughing, chest tightness, shortness of breath"
Asthma,"wheezing, chest tightness, shortness of breath, headache, nighttime coughing"
Asthma,"nighttime coughing, chest tightness, wheezing, shortness of breath, headache"
Asthma,"nighttime coughing, headache, wheezing, chest tightness, shortness of breath"
Asthma,"chest tightness, nighttime coughing, wheezing, headache, shortness of breath"
Arrhythmia,"irregular heartbeat, chest pain, dizziness, shortness of breath, fainting"
Arrhythmia,"irregular heartbeat, chest pain, fainting, dizziness, shortness of breath"
Arrhythmia,"shortness of breath, fainting, chest pain, dizziness, irregular heartbeat"
Arrhythmia,"dizziness, irregular heartbeat, chest pain, fainting, shortness of breath"
Arrhythmia,"fainting, dizziness, chest pain, irregular heartbeat, shortness of breath"
Arrhythmia,"irregular heartbeat, fainting, chest pain, shortness of breath, dizziness"
Arrhythmia,"dizziness, irregular heartbeat, shortness of breath, fainting, chest pain"
Arrhythmia,"fainting, irregular heartbeat, shortness of breath, dizziness, chest pain"
Arrhythmia,"irregular heartbeat, chest pain, shortness of breath, dizziness, fainting"
Arrhythmia,"chest pain, dizziness, irregular heartbeat, shortness of breath, fainting"
Avian Influenza,"runny nose, eye redness, sore throat, muscle pain, loss of appetite"
Avian Influenza,"eye redness, runny nose, muscle pain, sore throat, loss of appetite"
Avian Influenza,"eye redness, loss of appetite, sore throat, muscle pain, runny nose"
Avian Influenza,"muscle pain, loss of appetite, sore throat, eye redness, runny nose"
Avian Influenza,"runny nose, loss of appetite, sore throat, eye redness, muscle pain"
Avian Influenza,"runny nose, sore throat, loss of appetite, eye redness, muscle pain"
Avian Influenza,"runny nose, sore throat, eye redness, loss of appetite, muscle pain"
Avian Influenza,"loss of appetite, eye redness, runny nose, muscle pain, sore throat"
Avian Influenza,"eye redness, sore throat, muscle pain, loss of appetite, runny nose"
Avian Influenza,"runny nose, sore throat, eye redness, muscle pain, loss of appetite"
Babesiosis,"abdominal swelling, chills, muscle pain, sweating, fatigue"
Babesiosis,"muscle pain, fatigue, chills, sweating, abdominal swelling"
Babesiosis,"abdominal swelling, fatigue, sweating, muscle pain, chills"
Babesiosis,"abdominal swelling, muscle pain, fatigue, sweating, chills"
Babesiosis,"sweating, abdominal swelling, chills, fatigue, muscle pain"
Babesiosis,"sweating, muscle pain, abdominal swelling, chills, fatigue"
Babesiosis,"muscle pain, abdominal swelling, fatigue, sweating, chills"
Babesiosis,"fatigue, muscle pain, abdominal swelling, chills, sweating"
Babesiosis,"abdominal swelling, muscle pain, sweating, fatigue, chills"
Babesiosis,"sweating, chills, abdominal swelling, fatigue, muscle pain"
Bacterial Meningitis,"sensitivity to light, sleepiness, purple rash, joint pain, seizures"
Bacterial Meningitis,"joint pain, sleepiness, seizures, sensitivity to light, purple rash"
Bacterial Meningitis,"purple rash, sensitivity to light, joint pain, seizures, sleepiness"
Bacterial Meningitis,"sleepiness, seizures, joint pain, purple rash, sensitivity to light"
Bacterial Meningitis,"purple rash, seizures, joint pain, sensitivity to light, sleepiness"
Bacterial Meningitis,"sensitivity to light, sleepiness, seizures, purple rash, joint pain"
Bacterial Meningitis,"sensitivity to light, seizures, joint pain, purple rash, sleepiness"
Bacterial Meningitis,"purple rash, sensitivity to light, joint pain, sleepiness, seizures"
Bacterial Meningitis,"joint pain, seizures, purple rash, sensitivity to light, sleepiness"
Bacterial Meningitis,"seizures, purple rash, sleepiness, joint pain, sensitivity to light"
Bartonellosis,"tingling sensation, chills, sweating, high fever, headache"
Bartonellosis,"chills, tingling sensation, high fever, sweating, headache"
Bartonellosis,"tingling sensation, sweating, headache, high fever, chills"
Bartonellosis,"tingling sensation, high fever, sweating, chills, headache"
Bartonellosis,"sweating, chills, tingling sensation, high fever, headache"
Bartonellosis,"chills, sweating, headache, tingling sensation, high fever"
Bartonellosis,"tingling sensation, chills, high fever, headache, sweating"
Bartonellosis,"chills, sweating, high fever, tingling sensation, headache"
Bartonellosis,"chills, high fever, sweating, headache, tingling sensation"
Bartonellosis,"sweating, tingling sensation, high fever, headache, chills"
Barrett Esophagus,"heartburn, difficulty swallowing, chest pain,, regurgitation, sore throat"
Barrett Esophagus,"difficulty swallowing, regurgitation, chest pain,, heartburn, sore throat"
Barrett Esophagus,"chest pain,, regurgitation, sore throat, difficulty swallowing, heartburn"
Barrett Esophagus,"chest pain,, sore throat, difficulty swallowing, heartburn, regurgitation"
Barrett Esophagus,"heartburn, sore throat, chest pain,, difficulty swallowing, regurgitation"
Barrett Esophagus,"regurgitation, heartburn, sore throat, difficulty swallowing, chest pain,"
Barrett Esophagus,"chest pain,, sore throat, regurgitation, difficulty swallowing, heartburn"
Barrett Esophagus,"chest pain,, regurgitation, heartburn, difficulty swallowing, sore throat"
Barrett Esophagus,"difficulty swallowing, heartburn, regurgitation, chest pain,, sore throat"
Barrett Esophagus,"chest pain,, heartburn, sore throat, regurgitation, difficulty swallowing"
Bell's Palsy,"difficulty smiling, dry mouth, facial twitching, ear pain, tingling sensation"
Bell's Palsy,"difficulty smiling, facial twitching, ear pain, dry mouth, tingling sensation"
Bell's Palsy,"tingling sensation, facial twitching, dry mouth, ear pain, difficulty smiling"
Bell's Palsy,"facial twitching, tingling sensation, dry mouth, ear pain, difficulty smiling"
Bell's Palsy,"dry mouth, difficulty smiling, facial twitching, ear pain, tingling sensation"
Bell's Palsy,"ear pain, difficulty smiling, facial twitching, tingling sensation, dry mouth"
Bell's Palsy,"ear pain, tingling sensation, facial twitching, difficulty smiling, dry mouth"
Bell's Palsy,"facial twitching, difficulty smiling, ear pain, tingling sensation, dry mouth"
Bell's Palsy,"facial twitching, ear pain, tingling sensation, dry mouth, difficulty smiling"
Benign Paroxysmal Positional Vertigo (BPPV),"spinning movements, vomiting, loss of balance, nausea, headache"
Benign Paroxysmal Positional Vertigo (BPPV),"loss of balance, vomiting, spinning movements, nausea, headache"
Benign Paroxysmal Positional Vertigo (BPPV),"nausea, spinning movements, loss of balance, vomiting, headache"
Benign Paroxysmal Positional Vertigo (BPPV),"vomiting, loss of balance, spinning movements, headache, nausea"
Benign Paroxysmal Positional Vertigo (BPPV),"vomiting, nausea, spinning movements, loss of balance, headache"
Benign Paroxysmal Positional Vertigo (BPPV),"vomiting, loss of balance, nausea, headache, spinning movements"
Benign Paroxysmal Positional Vertigo (BPPV),"loss of balance, spinning movements, nausea, headache, vomiting"
Benign Paroxysmal Positional Vertigo (BPPV),"vomiting, loss of balance, spinning movements, nausea, headache"
Benign Paroxysmal Positional Vertigo (BPPV),"vomiting, headache, nausea, spinning movements, loss of balance"
Benign Paroxysmal Positional Vertigo (BPPV),"loss of balance, nausea, spinning movements, headache, vomiting"
Bipolar Disorder,"feelings of hopelessness, depression, impulsive behavior, hyperactivity, anxiety"
Bipolar Disorder,"hyperactivity, depression, feelings of hopelessness, impulsive behavior, anxiety"
Bipolar Disorder,"depression, feelings of hopelessness, hyperactivity, impulsive behavior, anxiety"
Bipolar Disorder,"depression, hyperactivity, feelings of hopelessness, impulsive behavior, anxiety"
Bipolar Disorder,"impulsive behavior, anxiety, hyperactivity, feelings of hopelessness, depression"
Bipolar Disorder,"hyperactivity, anxiety, impulsive behavior, feelings of hopelessness, depression"
Bipolar Disorder,"anxiety, depression, impulsive behavior, hyperactivity, feelings of hopelessness"
Bipolar Disorder,"feelings of hopelessness, hyperactivity, impulsive behavior, depression, anxiety"
Bipolar Disorder,"feelings of hopelessness, impulsive behavior, depression, anxiety, hyperactivity"
Bipolar Disorder,"hyperactivity, feelings of hopelessness, depression, impulsive behavior, anxiety"
Bladder Cancer,"pelvic pain, leg swelling, dark-colored urine, painful urination, chronic fatigue"
Bladder Cancer,"dark-colored urine, leg swelling, painful urination, chronic fatigue, pelvic pain"
Bladder Cancer,"chronic fatigue, leg swelling, dark-colored urine, painful urination, pelvic pain"
Bladder Cancer,"painful urination, dark-colored urine, leg swelling, pelvic pain, chronic fatigue"
Bladder Cancer,"chronic fatigue, pelvic pain, leg swelling, dark-colored urine, painful urination"
Bladder Cancer,"pelvic pain, dark-colored urine, painful urination, chronic fatigue, leg swelling"
Bladder Cancer,"leg swelling, painful urination, pelvic pain, dark-colored urine, chronic fatigue"
Bladder Cancer,"chronic fatigue, pelvic pain, painful urination, leg swelling, dark-colored urine"
