Disease,Symptoms
Lung Cancer,"coughing up blood, hoarseness, weight loss, loss of appetite, persistent chest pain"
Lung Cancer,"hoarseness, persistent chest pain, coughing up blood, loss of appetite, weight loss"
Lupus,"heart problems, depression, anxiety, weakness, swollen joints"
Lupus,"depression, heart problems, swollen joints, weakness, anxiety"
Lupus,"anxiety, weakness, heart problems, depression, swollen joints"
Lupus,"heart problems, swollen joints, depression, weakness, anxiety"
Lupus,"anxiety, weakness, depression, heart problems, swollen joints"
Lupus,"swollen joints, weakness, anxiety, heart problems, depression"
Lupus,"heart problems, swollen joints, weakness, anxiety, depression"
Lupus,"depression, swollen joints, anxiety, heart problems, weakness"
Lupus,"swollen joints, depression, weakness, heart problems, anxiety"
Lyme Disease,"chest discomfort, dehydration, low blood pressure, severe diarrhea, vomiting"
Lyme Disease,"vomiting, chest discomfort, low blood pressure, severe diarrhea, dehydration"
Lyme Disease,"dehydration, chest discomfort, low blood pressure, vomiting, severe diarrhea"
Lyme Disease,"chest discomfort, severe diarrhea, low blood pressure, dehydration, vomiting"
Lyme Disease,"severe diarrhea, low blood pressure, vomiting, chest discomfort, dehydration"
Lyme Disease,"dehydration, severe diarrhea, chest discomfort, low blood pressure, vomiting"
Lyme Disease,"low blood pressure, chest discomfort, severe diarrhea, vomiting, dehydration"
Lyme Disease,"severe diarrhea, chest discomfort, dehydration, low blood pressure, vomiting"
Lyme Disease,"dehydration, vomiting, chest discomfort, low blood pressure, severe diarrhea"
Lyme Disease,"low blood pressure, chest discomfort, dehydration, severe diarrhea, vomiting"
Lymphoma,"urinary urgency, cough, loss of taste or smell, shortness of breath, fatigue"
Lymphoma,"shortness of breath, urinary urgency, fatigue, loss of taste or smell, cough"
Lymphoma,"loss of taste or smell, urinary urgency, shortness of breath, cough, fatigue"
Lymphoma,"cough, loss of taste or smell, fatigue, urinary urgency, shortness of breath"
Lymphoma,"loss of taste or smell, shortness of breath, urinary urgency, fatigue, cough"
Lymphoma,"cough, shortness of breath, fatigue, loss of taste or smell, urinary urgency"
Lymphoma,"shortness of breath, cough, fatigue, urinary urgency, loss of taste or smell"
Lymphoma,"urinary urgency, loss of taste or smell, cough, shortness of breath, fatigue"
Lymphoma,"urinary urgency, shortness of breath, fatigue, cough, loss of taste or smell"
Lymphoma,"fatigue, loss of taste or smell, cough, shortness of breath, urinary urgency"
MERS,"small red spots on skin, cough, loss of taste or smell, shortness of breath, fatigue"
MERS,"loss of taste or smell, shortness of breath, small red spots on skin, cough, fatigue"
MERS,"fatigue, loss of taste or smell, cough, small red spots on skin, shortness of breath"
MERS,"shortness of breath, fatigue, loss of taste or smell, cough, small red spots on skin"
MERS,"shortness of breath, fatigue, small red spots on skin, loss of taste or smell, cough"
MERS,"fatigue, small red spots on skin, cough, shortness of breath, loss of taste or smell"
MERS,"loss of taste or smell, fatigue, shortness of breath, small red spots on skin, cough"
MERS,"small red spots on skin, fatigue, loss of taste or smell, shortness of breath, cough"
MERS,"shortness of breath, small red spots on skin, cough, fatigue, loss of taste or smell"
MERS,"cough, fatigue, loss of taste or smell, shortness of breath, small red spots on skin"
Macular Degeneration,"ear pain, chills, sweating, high fever, headache"
Macular Degeneration,"ear pain, chills, high fever, sweating, headache"
Macular Degeneration,"chills, sweating, headache, ear pain, high fever"
Macular Degeneration,"chills, high fever, ear pain, headache, sweating"
Macular Degeneration,"sweating, headache, high fever, ear pain, chills"
Macular Degeneration,"high fever, sweating, headache, ear pain, chills"
Macular Degeneration,"sweating, chills, headache, high fever, ear pain"
Macular Degeneration,"headache, sweating, high fever, chills, ear pain"
Macular Degeneration,"ear pain, high fever, headache, chills, sweating"
Malaria,"cycles of chills and fever, muscle aches, night sweats, vomiting, fatigue"
Malaria,"night sweats, muscle aches, vomiting, fatigue, cycles of chills and fever"
Malaria,"night sweats, vomiting, muscle aches, fatigue, cycles of chills and fever"
Malaria,"vomiting, cycles of chills and fever, muscle aches, night sweats, fatigue"
Malaria,"muscle aches, fatigue, night sweats, vomiting, cycles of chills and fever"
Malaria,"muscle aches, cycles of chills and fever, vomiting, night sweats, fatigue"
Malaria,"vomiting, fatigue, night sweats, cycles of chills and fever, muscle aches"
Malaria,"muscle aches, fatigue, cycles of chills and fever, vomiting, night sweats"
Malaria,"fatigue, cycles of chills and fever, night sweats, muscle aches, vomiting"
Malaria,"fatigue, muscle aches, cycles of chills and fever, night sweats, vomiting"
Marburg Virus,"depression, chest pain, cough, shortness of breath, fatigue"
Marburg Virus,"chest pain, fatigue, shortness of breath, cough, depression"
Marburg Virus,"fatigue, cough, depression, chest pain, shortness of breath"
Marburg Virus,"chest pain, cough, depression, shortness of breath, fatigue"
Marburg Virus,"chest pain, cough, fatigue, shortness of breath, depression"
Marburg Virus,"shortness of breath, cough, fatigue, chest pain, depression"
Marburg Virus,"chest pain, cough, fatigue, depression, shortness of breath"
Marburg Virus,"cough, shortness of breath, fatigue, chest pain, depression"
Marburg Virus,"fatigue, chest pain, depression, cough, shortness of breath"
Marburg Virus,"shortness of breath, chest pain, fatigue, cough, depression"
Measles,"swollen salivary glands, dehydration, low blood pressure, severe diarrhea, vomiting"
Measles,"swollen salivary glands, vomiting, low blood pressure, dehydration, severe diarrhea"
Measles,"dehydration, vomiting, severe diarrhea, low blood pressure, swollen salivary glands"
Measles,"severe diarrhea, low blood pressure, swollen salivary glands, vomiting, dehydration"
Measles,"vomiting, severe diarrhea, dehydration, low blood pressure, swollen salivary glands"
Measles,"severe diarrhea, low blood pressure, dehydration, swollen salivary glands, vomiting"
Measles,"vomiting, low blood pressure, swollen salivary glands, dehydration, severe diarrhea"
Measles,"severe diarrhea, vomiting, dehydration, low blood pressure, swollen salivary glands"
Measles,"low blood pressure, swollen salivary glands, dehydration, severe diarrhea, vomiting"
Measles,"swollen salivary glands, severe diarrhea, vomiting, dehydration, low blood pressure"
Melanoma,"patches in throat, chest pain, cough, shortness of breath, fatigue"
Melanoma,"fatigue, cough, chest pain, patches in throat, shortness of breath"
Melanoma,"fatigue, cough, chest pain, shortness of breath, patches in throat"
Melanoma,"patches in throat, fatigue, chest pain, cough, shortness of breath"
Melanoma,"shortness of breath, chest pain, patches in throat, cough, fatigue"
Melanoma,"shortness of breath, fatigue, chest pain, cough, patches in throat"
Melanoma,"chest pain, fatigue, patches in throat, shortness of breath, cough"
Melanoma,"shortness of breath, fatigue, patches in throat, chest pain, cough"
Melanoma,"chest pain, fatigue, cough, patches in throat, shortness of breath"
Melanoma,"chest pain, cough, fatigue, shortness of breath, patches in throat"
Metabolic Syndrome,"high blood sugar, increased thirst, excessive hunger, weight gain, confusion"
Metabolic Syndrome,"confusion, increased thirst, excessive hunger, high blood sugar, weight gain"
Metabolic Syndrome,"high blood sugar, excessive hunger, weight gain, increased thirst, confusion"
Metabolic Syndrome,"high blood sugar, weight gain, confusion, increased thirst, excessive hunger"
Metabolic Syndrome,"confusion, excessive hunger, high blood sugar, increased thirst, weight gain"
Metabolic Syndrome,"increased thirst, weight gain, excessive hunger, confusion, high blood sugar"
Metabolic Syndrome,"weight gain, increased thirst, confusion, excessive hunger, high blood sugar"
Metabolic Syndrome,"increased thirst, high blood sugar, confusion, excessive hunger, weight gain"
Metabolic Syndrome,"high blood sugar, confusion, excessive hunger, weight gain, increased thirst"
Metabolic Syndrome,"excessive hunger, weight gain, high blood sugar, increased thirst, confusion"
Migraine,"visual disturbances, sensitivity to sound, throbbing headache, nausea, confusion"
Migraine,"visual disturbances, confusion, throbbing headache, sensitivity to sound, nausea"
Migraine,"nausea, confusion, throbbing headache, sensitivity to sound, visual disturbances"
Migraine,"visual disturbances, sensitivity to sound, confusion, throbbing headache, nausea"
Migraine,"confusion, visual disturbances, sensitivity to sound, nausea, throbbing headache"
Migraine,"sensitivity to sound, confusion, throbbing headache, nausea, visual disturbances"
Migraine,"sensitivity to sound, nausea, confusion, visual disturbances, throbbing headache"
Migraine,"visual disturbances, confusion, nausea, sensitivity to sound, throbbing headache"
Migraine,"confusion, throbbing headache, visual disturbances, sensitivity to sound, nausea"
Multiple Sclerosis,"mouth ulcers, chills, sweating, high fever, headache"
Multiple Sclerosis,"headache, chills, sweating, mouth ulcers, high fever"
Multiple Sclerosis,"high fever, sweating, chills, headache, mouth ulcers"
Multiple Sclerosis,"high fever, chills, mouth ulcers, headache, sweating"
Multiple Sclerosis,"sweating, high fever, headache, chills, mouth ulcers"
Multiple Sclerosis,"headache, high fever, mouth ulcers, sweating, chills"
Multiple Sclerosis,"high fever, sweating, mouth ulcers, headache, chills"
Multiple Sclerosis,"headache, sweating, mouth ulcers, high fever, chills"
Multiple Sclerosis,"mouth ulcers, sweating, headache, chills, high fever"
Multiple Sclerosis,"chills, mouth ulcers, sweating, high fever, headache"
Mumps,"swollen salivary glands, pain while chewing, fever, muscle aches, fatigue"
Mumps,"fatigue, swollen salivary glands, fever, muscle aches, pain while chewing"
Mumps,"muscle aches, fatigue, fever, pain while chewing, swollen salivary glands"
Mumps,"muscle aches, pain while chewing, fever, fatigue, swollen salivary glands"
Mumps,"fever, muscle aches, pain while chewing, swollen salivary glands, fatigue"
Mumps,"fever, fatigue, swollen salivary glands, muscle aches, pain while chewing"
Mumps,"pain while chewing, swollen salivary glands, fever, muscle aches, fatigue"
Mumps,"muscle aches, pain while chewing, swollen salivary glands, fatigue, fever"
Mumps,"fever, pain while chewing, muscle aches, swollen salivary glands, fatigue"
Mumps,"fatigue, pain while chewing, fever, muscle aches, swollen salivary glands"
Myasthenia Gravis,"muscle weakness, drooping eyelids, difficulty swallowing, double vision, severe headache"
Myasthenia Gravis,"muscle weakness, drooping eyelids, difficulty swallowing, severe headache, double vision"
Myasthenia Gravis,"muscle weakness, double vision, difficulty swallowing, severe headache, drooping eyelids"
Myasthenia Gravis,"double vision, difficulty swallowing, severe headache, muscle weakness, drooping eyelids"
Myasthenia Gravis,"muscle weakness, severe headache, drooping eyelids, double vision, difficulty swallowing"
Myasthenia Gravis,"difficulty swallowing, muscle weakness, drooping eyelids, double vision, severe headache"
Myasthenia Gravis,"muscle weakness, severe headache, drooping eyelids, difficulty swallowing, double vision"
Myasthenia Gravis,"difficulty swallowing, severe headache, drooping eyelids, muscle weakness, double vision"
Myasthenia Gravis,"muscle weakness, difficulty swallowing, severe headache, double vision, drooping eyelids"
Myasthenia Gravis,"drooping eyelids, double vision, difficulty swallowing, muscle weakness, severe headache"
Mycoplasma Pneumonia,"hearing loss, cough, loss of taste or smell, shortness of breath, fatigue"
Mycoplasma Pneumonia,"hearing loss, shortness of breath, cough, loss of taste or smell, fatigue"
Mycoplasma Pneumonia,"loss of taste or smell, fatigue, cough, hearing loss, shortness of breath"
Mycoplasma Pneumonia,"loss of taste or smell, cough, fatigue, hearing loss, shortness of breath"
Mycoplasma Pneumonia,"shortness of breath, loss of taste or smell, hearing loss, fatigue, cough"
Mycoplasma Pneumonia,"loss of taste or smell, shortness of breath, hearing loss, fatigue, cough"
Mycoplasma Pneumonia,"loss of taste or smell, fatigue, cough, shortness of breath, hearing loss"
Mycoplasma Pneumonia,"fatigue, shortness of breath, loss of taste or smell, cough, hearing loss"
Mycoplasma Pneumonia,"hearing loss, loss of taste or smell, fatigue, cough, shortness of breath"
Mycoplasma Pneumonia,"shortness of breath, cough, fatigue, loss of taste or smell, hearing loss"
Narcolepsy,"joint pain, dehydration, low blood pressure, severe diarrhea, vomiting"
Narcolepsy,"dehydration, joint pain, severe diarrhea, vomiting, low blood pressure"
Narcolepsy,"low blood pressure, dehydration, joint pain, severe diarrhea, vomiting"
Narcolepsy,"vomiting, severe diarrhea, joint pain, dehydration, low blood pressure"
Narcolepsy,"joint pain, vomiting, severe diarrhea, low blood pressure, dehydration"
Narcolepsy,"joint pain, low blood pressure, dehydration, severe diarrhea, vomiting"
Narcolepsy,"joint pain, dehydration, vomiting, low blood pressure, severe diarrhea"
Narcolepsy,"joint pain, dehydration, low blood pressure, vomiting, severe diarrhea"
Narcolepsy,"dehydration, joint pain, vomiting, severe diarrhea, low blood pressure"
Narcolepsy,"low blood pressure, joint pain, severe diarrhea, dehydration, vomiting"
Nipah Virus,"abdominal discomfort, dehydration, low blood pressure, severe diarrhea, vomiting"
Nipah Virus,"dehydration, low blood pressure, severe diarrhea, vomiting, abdominal discomfort"
Nipah Virus,"severe diarrhea, abdominal discomfort, low blood pressure, vomiting, dehydration"
Nipah Virus,"dehydration, low blood pressure, abdominal discomfort, vomiting, severe diarrhea"
Nipah Virus,"severe diarrhea, low blood pressure, dehydration, vomiting, abdominal discomfort"
Nipah Virus,"dehydration, vomiting, low blood pressure, severe diarrhea, abdominal discomfort"
Nipah Virus,"severe diarrhea, abdominal discomfort, dehydration, vomiting, low blood pressure"
Nipah Virus,"severe diarrhea, dehydration, abdominal discomfort, vomiting, low blood pressure"
Nipah Virus,"vomiting, dehydration, severe diarrhea, low blood pressure, abdominal discomfort"
Nipah Virus,"vomiting, severe diarrhea, abdominal discomfort, dehydration, low blood pressure"
Norovirus,"pale skin, cough, mucus production, wheezing, fatigue"
Norovirus,"pale skin, fatigue, cough, mucus production, wheezing"
Norovirus,"pale skin, cough, fatigue, mucus production, wheezing"
Norovirus,"mucus production, cough, wheezing, pale skin, fatigue"
Norovirus,"pale skin, fatigue, cough, wheezing, mucus production"
Norovirus,"wheezing, mucus production, pale skin, fatigue, cough"
Norovirus,"wheezing, mucus production, fatigue, pale skin, cough"
Norovirus,"wheezing, cough, mucus production, fatigue, pale skin"
Norovirus,"pale skin, mucus production, fatigue, wheezing, cough"
Norovirus,"fatigue, cough, mucus production, wheezing, pale skin"
Obesity,"distention of abdomen, dehydration, low blood pressure, severe diarrhea, vomiting"
Obesity,"distention of abdomen, dehydration, vomiting, severe diarrhea, low blood pressure"
Obesity,"distention of abdomen, low blood pressure, severe diarrhea, vomiting, dehydration"
Obesity,"low blood pressure, dehydration, severe diarrhea, vomiting, distention of abdomen"
Obesity,"severe diarrhea, distention of abdomen, low blood pressure, vomiting, dehydration"
Obesity,"dehydration, severe diarrhea, distention of abdomen, low blood pressure, vomiting"
Obesity,"distention of abdomen, vomiting, low blood pressure, severe diarrhea, dehydration"
Obesity,"low blood pressure, dehydration, severe diarrhea, distention of abdomen, vomiting"
Obesity,"low blood pressure, dehydration, distention of abdomen, severe diarrhea, vomiting"
Obesity,"distention of abdomen, vomiting, severe diarrhea, dehydration, low blood pressure"
Onchocerciasis,"easy bruising, cough, mucus production, wheezing, fatigue"
Onchocerciasis,"cough, fatigue, mucus production, easy bruising, wheezing"
Onchocerciasis,"easy bruising, wheezing, fatigue, mucus production, cough"
Onchocerciasis,"easy bruising, wheezing, mucus production, cough, fatigue"
Onchocerciasis,"cough, fatigue, easy bruising, wheezing, mucus production"
Onchocerciasis,"cough, wheezing, easy bruising, fatigue, mucus production"
Onchocerciasis,"mucus production, fatigue, cough, easy bruising, wheezing"
Onchocerciasis,"mucus production, fatigue, wheezing, cough, easy bruising"
Onchocerciasis,"easy bruising, fatigue, wheezing, cough, mucus production"
Onchocerciasis,"cough, wheezing, mucus production, fatigue, easy bruising"
Osteoarthristis,"swelling joints, neck pain, knee pain, hip joint pain, joint pain"
Osteoarthristis,"swelling joints, joint pain, hip joint pain, knee pain, neck pain"
Osteoarthristis,"swelling joints, knee pain, joint pain, hip joint pain, neck pain"
Osteoarthristis,"neck pain, swelling joints, joint pain, hip joint pain, knee pain"
Osteoarthristis,"neck pain, joint pain, swelling joints, hip joint pain, knee pain"
Osteoarthristis,"hip joint pain, swelling joints, joint pain, neck pain, knee pain"
Osteoarthristis,"knee pain, joint pain, neck pain, swelling joints, hip joint pain"
Osteoarthristis,"joint pain, hip joint pain, neck pain, knee pain, swelling joints"
Osteoarthristis,"neck pain, knee pain, hip joint pain, swelling joints, joint pain"
Osteoarthristis,"neck pain, knee pain, joint pain, swelling joints, hip joint pain"
Osteoporosis,"difficulty seeing at night, fever, night sweats, weight loss, fatigue"
Osteoporosis,"fatigue, night sweats, weight loss, difficulty seeing at night, fever"
Osteoporosis,"weight loss, difficulty seeing at night, night sweats, fatigue, fever"
Osteoporosis,"fever, fatigue, weight loss, difficulty seeing at night, night sweats"
Osteoporosis,"weight loss, fatigue, difficulty seeing at night, night sweats, fever"
Osteoporosis,"difficulty seeing at night, night sweats, fatigue, fever, weight loss"
Osteoporosis,"fever, night sweats, weight loss, difficulty seeing at night, fatigue"
Osteoporosis,"weight loss, night sweats, fatigue, fever, difficulty seeing at night"
Osteoporosis,"fatigue, difficulty seeing at night, night sweats, weight loss, fever"
Otitis Media,"heavy menstrual bleeding, cough, mucus production, wheezing, fatigue"
Otitis Media,"cough, wheezing, heavy menstrual bleeding, mucus production, fatigue"
Otitis Media,"cough, fatigue, wheezing, mucus production, heavy menstrual bleeding"
Otitis Media,"heavy menstrual bleeding, fatigue, wheezing, mucus production, cough"
Otitis Media,"wheezing, cough, fatigue, mucus production, heavy menstrual bleeding"
Otitis Media,"mucus production, fatigue, cough, wheezing, heavy menstrual bleeding"
Otitis Media,"mucus production, wheezing, cough, fatigue, heavy menstrual bleeding"
Otitis Media,"fatigue, heavy menstrual bleeding, mucus production, wheezing, cough"
Otitis Media,"heavy menstrual bleeding, fatigue, mucus production, cough, wheezing"
Otitis Media,"fatigue, mucus production, wheezing, heavy menstrual bleeding, cough"
Ovarian Cancer,"cloudy vision, dehydration, low blood pressure, severe diarrhea, vomiting"
Ovarian Cancer,"low blood pressure, dehydration, cloudy vision, vomiting, severe diarrhea"
Ovarian Cancer,"cloudy vision, severe diarrhea, low blood pressure, vomiting, dehydration"
Ovarian Cancer,"vomiting, severe diarrhea, cloudy vision, dehydration, low blood pressure"
Ovarian Cancer,"cloudy vision, low blood pressure, vomiting, severe diarrhea, dehydration"
Ovarian Cancer,"dehydration, cloudy vision, vomiting, low blood pressure, severe diarrhea"
Ovarian Cancer,"vomiting, low blood pressure, dehydration, severe diarrhea, cloudy vision"
Ovarian Cancer,"vomiting, severe diarrhea, dehydration, cloudy vision, low blood pressure"
Ovarian Cancer,"cloudy vision, dehydration, vomiting, low blood pressure, severe diarrhea"
Ovarian Cancer,"cloudy vision, vomiting, severe diarrhea, dehydration, low blood pressure"
Pancreatic Cancer,"bruising, fever, night sweats, weight loss, fatigue"
Pancreatic Cancer,"night sweats, bruising, fever, fatigue, weight loss"
Pancreatic Cancer,"bruising, fatigue, weight loss, night sweats, fever"
Pancreatic Cancer,"night sweats, bruising, fever, weight loss, fatigue"
Pancreatic Cancer,"weight loss, fatigue, fever, night sweats, bruising"
Pancreatic Cancer,"weight loss, night sweats, fever, bruising, fatigue"
Pancreatic Cancer,"weight loss, bruising, fatigue, fever, night sweats"
Pancreatic Cancer,"night sweats, weight loss, fatigue, bruising, fever"
Pancreatic Cancer,"fever, fatigue, bruising, night sweats, weight loss"
Pancreatic Cancer,"night sweats, weight loss, fever, bruising, fatigue"
Paralysis (brain hemorrhage),"altered sensorium, headache, weakness of one body side, vomiting, loss of balance"
Paralysis (brain hemorrhage),"weakness of one body side, altered sensorium, headache, loss of balance, vomiting"
Paralysis (brain hemorrhage),"weakness of one body side, loss of balance, headache, altered sensorium, vomiting"
Paralysis (brain hemorrhage),"altered sensorium, headache, weakness of one body side, loss of balance, vomiting"
Paralysis (brain hemorrhage),"headache, weakness of one body side, altered sensorium, vomiting, loss of balance"
Paralysis (brain hemorrhage),"vomiting, loss of balance, altered sensorium, headache, weakness of one body side"
Paralysis (brain hemorrhage),"weakness of one body side, headache, loss of balance, altered sensorium, vomiting"
Paralysis (brain hemorrhage),"vomiting, altered sensorium, weakness of one body side, loss of balance, headache"
Paralysis (brain hemorrhage),"loss of balance, weakness of one body side, vomiting, altered sensorium, headache"
Paralysis (brain hemorrhage),"vomiting, loss of balance, weakness of one body side, altered sensorium, headache"
Parkinson's Disease,"tremors, slow movement, stiffness, balance issues, vomiting"
Parkinson's Disease,"tremors, vomiting, stiffness, balance issues, slow movement"
Parkinson's Disease,"vomiting, tremors, stiffness, slow movement, balance issues"
Parkinson's Disease,"vomiting, slow movement, stiffness, tremors, balance issues"
Parkinson's Disease,"slow movement, vomiting, tremors, stiffness, balance issues"
Parkinson's Disease,"stiffness, balance issues, tremors, vomiting, slow movement"
Parkinson's Disease,"vomiting, slow movement, stiffness, balance issues, tremors"
Parkinson's Disease,"vomiting, balance issues, slow movement, tremors, stiffness"
Parkinson's Disease,"slow movement, balance issues, vomiting, tremors, stiffness"
Parkinson's Disease,"vomiting, stiffness, slow movement, balance issues, tremors"
Pelvic Inflammatory Disease,"lower abdominal pain, pain during intercourse, unusual vaginal discharge, fever, fatigue"
Pelvic Inflammatory Disease,"fatigue, fever, lower abdominal pain, pain during intercourse, unusual vaginal discharge"
Pelvic Inflammatory Disease,"pain during intercourse, fever, fatigue, lower abdominal pain, unusual vaginal discharge"
Pelvic Inflammatory Disease,"pain during intercourse, lower abdominal pain, fever, unusual vaginal discharge, fatigue"
Pelvic Inflammatory Disease,"fever, pain during intercourse, lower abdominal pain, unusual vaginal discharge, fatigue"
Pelvic Inflammatory Disease,"pain during intercourse, fever, unusual vaginal discharge, fatigue, lower abdominal pain"
Pelvic Inflammatory Disease,"unusual vaginal discharge, pain during intercourse, fever, lower abdominal pain, fatigue"
Pelvic Inflammatory Disease,"fatigue, lower abdominal pain, pain during intercourse, unusual vaginal discharge, fever"
Pelvic Inflammatory Disease,"unusual vaginal discharge, lower abdominal pain, fever, pain during intercourse, fatigue"
Peptic ulcer disease,"indigestion, vomiting, loss of appetite, abdominal pain, passage of gases"
Peptic ulcer disease,"indigestion, loss of appetite, abdominal pain, vomiting, passage of gases"
Peptic ulcer disease,"abdominal pain, passage of gases, indigestion, vomiting, loss of appetite"
Peptic ulcer disease,"vomiting, abdominal pain, indigestion, loss of appetite, passage of gases"
Peptic ulcer disease,"abdominal pain, loss of appetite, vomiting, passage of gases, indigestion"
Peptic ulcer disease,"vomiting, abdominal pain, passage of gases, loss of appetite, indigestion"
Peptic ulcer disease,"vomiting, abdominal pain, loss of appetite, passage of gases, indigestion"
Peptic ulcer disease,"loss of appetite, passage of gases, vomiting, abdominal pain, indigestion"
Peptic ulcer disease,"indigestion, abdominal pain, loss of appetite, vomiting, passage of gases"
Peptic ulcer disease,"passage of gases, indigestion, abdominal pain, vomiting, loss of appetite"
Peripheral Neuropathy,"yellowing skin, cough, loss of taste or smell, shortness of breath, fatigue"
Peripheral Neuropathy,"loss of taste or smell, yellowing skin, cough, fatigue, shortness of breath"
Peripheral Neuropathy,"yellowing skin, cough, shortness of breath, loss of taste or smell, fatigue"
Peripheral Neuropathy,"cough, loss of taste or smell, shortness of breath, yellowing skin, fatigue"
Peripheral Neuropathy,"yellowing skin, fatigue, shortness of breath, loss of taste or smell, cough"
